timestamp,source,text,name,rating,jpg_url,img_num,dog_breed,retweet_count,favorite_count
2016-04-13 01:22:10,"<a href=""http://twitter.com/download/iphone"" rel=""nofollow"">Twitter for iPhone</a>",This is Charleson. He lost his plunger. Looked everywhere. Can't find it. So sad. 9/10 would comfort https://t.co/pRHX8yn9Yu,Charleson,9/10,https://pbs.twimg.com/media/Cf4qRcmWEAA9V4h.jpg,1,Mexican_hairless,1268,4229
2016-04-13 00:17:25,"<a href=""http://twitter.com/download/iphone"" rel=""nofollow"">Twitter for iPhone</a>",This is Neptune. He's a Snowy Swiss Mountain Floofapolis. Cheeky wink. Tongue nifty af. 11/10 would pet so firmly https://t.co/SoZq2Xoopv,Neptune,11/10,https://pbs.twimg.com/media/Cf4bcm8XEAAX4xV.jpg,1,Samoyed,2253,5332
2016-04-12 20:50:42,"<a href=""http://twitter.com/download/iphone"" rel=""nofollow"">Twitter for iPhone</a>",This doggo was initially thrilled when she saw the happy cartoon pup but quickly realized she'd been deceived. 10/10 https://t.co/mvnBGaWULV,None,10/10,https://pbs.twimg.com/media/Cf3sH62VAAA-LiP.jpg,2,golden_retriever,1979,5281
2016-04-11 15:43:12,"<a href=""http://twitter.com/download/iphone"" rel=""nofollow"">Twitter for iPhone</a>",This is Harnold. He accidentally opened the front facing camera. 10/10 get it together Harnold https://t.co/S6JHaSMtln,Harnold,10/10,https://pbs.twimg.com/media/CfxcKU6W8AE-wEx.jpg,1,malamute,2192,5515
2016-04-11 01:41:07,"<a href=""http://twitter.com/download/iphone"" rel=""nofollow"">Twitter for iPhone</a>",Say hello to Lucy and Sophie. They think they're the same size. Both 10/10 would snug at same time https://t.co/HW50zkcf2R,Lucy,10/10,https://pbs.twimg.com/media/Cfuba6NW4AIeMHk.jpg,1,golden_retriever,1403,4822
2016-04-11 01:13:34,"<a href=""http://twitter.com/download/iphone"" rel=""nofollow"">Twitter for iPhone</a>",This is Pippa. She managed to start the car but is waiting for you to buckle up before driving. Responsible af 11/10 https://t.co/htrlmC7saz,Pippa,11/10,https://pbs.twimg.com/media/CfuVGl3WEAEKb16.jpg,1,Dandie_Dinmont,1078,3711
2016-04-10 01:20:33,"<a href=""http://twitter.com/download/iphone"" rel=""nofollow"">Twitter for iPhone</a>",This is Sadie. She is prepared for battle. 10/10 https://t.co/JRckDkZVRT,Sadie,10/10,https://pbs.twimg.com/media/CfpNGTHUIAAA8XC.jpg,1,golden_retriever,1231,3818
2016-04-09 23:10:47,"<a href=""http://twitter.com/download/iphone"" rel=""nofollow"">Twitter for iPhone</a>",This is Otis. Everybody look at Otis. 12/10 would probably faint while petting https://t.co/I9qoe1uEih,Otis,12/10,https://pbs.twimg.com/media/CfovbK4WIAAkTn3.jpg,1,Pembroke,1973,5720
2016-04-09 02:47:55,"<a href=""http://twitter.com/download/iphone"" rel=""nofollow"">Twitter for iPhone</a>",We normally don't rate marshmallows but this one appears to be flawlessly toasted so I'll make an exception. 10/10 https://t.co/D9jbbmPmos,None,10/10,https://pbs.twimg.com/media/CfkXiX6W4AAmICF.jpg,1,Pomeranian,9126,20697
2016-04-09 01:35:37,"<a href=""http://twitter.com/download/iphone"" rel=""nofollow"">Twitter for iPhone</a>",This is Carper. He's a Tortellini Angiosperm. In desperate need of a petting. 11/10 would hug softly https://t.co/lK9YDkRzPj,Carper,11/10,https://pbs.twimg.com/media/CfkG_PMWsAAH0MZ.jpg,1,Labrador_retriever,542,2669
2016-04-08 20:46:50,"<a href=""http://twitter.com/download/iphone"" rel=""nofollow"">Twitter for iPhone</a>",Get you a pup that can do both. 10/10 https://t.co/zSbyvm62xZ,None,10/10,https://pbs.twimg.com/media/CfjE5FRXEAErFWR.jpg,2,Maltese_dog,1137,2730
2016-04-08 01:19:36,"<a href=""http://twitter.com/download/iphone"" rel=""nofollow"">Twitter for iPhone</a>",This is Alexanderson. He's got a weird ass birth mark. Dreadful at fetch. Won't eat kibble. 3/10 wtf @Target https://t.co/FmxOpf2Sgl,Alexanderson,3/10,https://pbs.twimg.com/media/Cfe5tLWXEAIaoFO.jpg,1,Chihuahua,565,2115
2016-04-08 00:30:51,"<a href=""http://twitter.com/download/iphone"" rel=""nofollow"">Twitter for iPhone</a>",This is Suki. She was born with a blurry tail (unfortunate). Next level tongue tho. 11/10 nifty hardwood https://t.co/05S8oYztgb,Suki,11/10,https://pbs.twimg.com/media/CfeukpmW4AEGjOE.jpg,1,malamute,1127,4217
2016-04-06 22:29:56,"<a href=""http://twitter.com/download/iphone"" rel=""nofollow"">Twitter for iPhone</a>",This is Barclay. His father was a banana. 11/10 appeeling af https://t.co/ucOEfr2rjV,Barclay,11/10,https://pbs.twimg.com/media/CfZJTphWAAAl5Ys.jpg,1,Brittany_spaniel,670,2660
2016-04-06 02:21:30,"<a href=""http://twitter.com/download/iphone"" rel=""nofollow"">Twitter for iPhone</a>",People please. This is a Deadly Mediterranean Plop T-Rex. We only rate dogs. Only send in dogs. Thanks you... 11/10 https://t.co/2ATDsgHD4n,a,11/10,https://pbs.twimg.com/media/CfU0t75W4AAUo9V.jpg,1,golden_retriever,2069,6281
2016-04-05 18:41:02,"<a href=""http://twitter.com/download/iphone"" rel=""nofollow"">Twitter for iPhone</a>",This is Ebby. She's a Zimbabwean Feta. Embarrassed by ridiculously squishy face. 9/10 would squeeze softly https://t.co/LBJqxMGaHi,Ebby,9/10,https://pbs.twimg.com/media/CfTLUYWXEAEkyES.jpg,2,miniature_pinscher,945,3446
2016-04-04 17:53:31,"<a href=""http://twitter.com/download/iphone"" rel=""nofollow"">Twitter for iPhone</a>",This is FlÃ¡vio (pronounced Baxter). He's a Benesnoop Cumberdog. Super rare. Symmetrical. 12/10 would pet so well https://t.co/fGgleFiBPq,FlÃ¡vio,12/10,https://pbs.twimg.com/media/CfN23ArXEAEkZkz.jpg,1,golden_retriever,2135,6826
2016-04-04 15:22:08,"<a href=""http://twitter.com/download/iphone"" rel=""nofollow"">Twitter for iPhone</a>",This is Smokey. He's having some sort of existential crisis. 10/10 hang in there pupper https://t.co/JmgF4dMpw0,Smokey,10/10,https://pbs.twimg.com/media/CfNUNetW8AAekHx.jpg,1,Siberian_husky,1102,3583
2016-04-04 01:41:58,"<a href=""http://twitter.com/download/iphone"" rel=""nofollow"">Twitter for iPhone</a>",This is Link. He struggles with couches. 10/10 would assist https://t.co/SbX4e6Yg3o,Link,10/10,https://pbs.twimg.com/media/CfKYfeBXIAAopp2.jpg,2,malinois,1317,4627
2016-04-04 00:55:01,"<a href=""http://twitter.com/download/iphone"" rel=""nofollow"">Twitter for iPhone</a>",Meet Jennifur. She's supposed to be navigating. Not even buckled up. Insubordinate &amp; churlish. 11/10 would still pet https://t.co/h0trcJohYO,Jennifur,11/10,https://pbs.twimg.com/media/CfKNvU8WsAAvI9Z.jpg,1,Pomeranian,1474,5204
2016-04-03 01:36:11,"<a href=""http://twitter.com/download/iphone"" rel=""nofollow"">Twitter for iPhone</a>",This is Bluebert. He just saw that both #FinalFur match ups are split 50/50. Amazed af. 11/10 https://t.co/Kky1DPG4iq,Bluebert,50/50,https://pbs.twimg.com/media/CfFNk7cWAAA-hND.jpg,1,Siberian_husky,247,2574
2016-04-02 15:25:47,"<a href=""http://twitter.com/download/iphone"" rel=""nofollow"">Twitter for iPhone</a>",This is Stephanus. She stays woke. 12/10 https://t.co/WIWabMngQZ,Stephanus,12/10,https://pbs.twimg.com/media/CfDB3aJXEAAEZNv.jpg,1,Yorkshire_terrier,1225,3041
2016-04-02 01:52:38,"<a href=""http://twitter.com/download/iphone"" rel=""nofollow"">Twitter for iPhone</a>",Here's a super majestic doggo and a sunset 11/10 https://t.co/UACnoyi8zu,None,11/10,https://pbs.twimg.com/media/CfAHv83UMAIEQYx.jpg,1,golden_retriever,1935,5272
2016-04-01 15:46:52,"<a href=""http://twitter.com/download/iphone"" rel=""nofollow"">Twitter for iPhone</a>",This is Bubbles. He's a Yorkshire Piccolope. 11/10 would snug aggressively https://t.co/3BhMojONxq,Bubbles,11/10,https://pbs.twimg.com/media/Ce99GhLW8AAHG38.jpg,1,pug,987,3485
2016-04-01 02:51:22,"<a href=""http://twitter.com/download/iphone"" rel=""nofollow"">Twitter for iPhone</a>",This is a taco. We only rate dogs. Please only send in dogs. Dogs are what we rate. Not tacos. Thank you... 10/10 https://t.co/cxl6xGY8B9,a,10/10,https://pbs.twimg.com/media/Ce7LlUeUUAEQkQl.jpg,1,Dandie_Dinmont,1920,5093
2016-04-01 00:26:15,"<a href=""http://twitter.com/download/iphone"" rel=""nofollow"">Twitter for iPhone</a>",Meet Toby. He's a Lithuanian High-Steppin Stickeroo. One of the more accomplished Stickeroos around. 10/10 so nifty https://t.co/cYPHuJYTjC,Toby,10/10,https://pbs.twimg.com/media/Ce6qZC2WAAAcSoI.jpg,1,Staffordshire_bullterrier,1454,4257
2016-03-31 23:22:53,"<a href=""http://twitter.com/download/iphone"" rel=""nofollow"">Twitter for iPhone</a>",This is Zeus. He's downright fabulous. 12/10 https://t.co/sSugyyRuTp,Zeus,12/10,https://pbs.twimg.com/media/Ce6b4MPWwAA22Xm.jpg,1,golden_retriever,1813,4719
2016-03-31 00:58:29,"<a href=""http://twitter.com/download/iphone"" rel=""nofollow"">Twitter for iPhone</a>",This is Oscar. He's a world renowned snowball inspector. It's a ruff job but someone has to do it. 10/10 great guy https://t.co/vSufMAKm3C,Oscar,10/10,https://pbs.twimg.com/media/Ce1oLNqWAAE34w7.jpg,1,West_Highland_white_terrier,768,3294
2016-03-30 16:52:36,"<a href=""http://twitter.com/download/iphone"" rel=""nofollow"">Twitter for iPhone</a>",This is Nico. His selfie game is strong af. Excellent use of a sneaky tongue slip. 10/10 star material https://t.co/1OBdJkMOFx,Nico,10/10,https://pbs.twimg.com/media/Cez49UqWsAIRQXc.jpg,1,Chihuahua,736,2630
2016-03-30 15:34:51,"<a href=""http://twitter.com/download/iphone"" rel=""nofollow"">Twitter for iPhone</a>",This is Michelangelope. He's half coffee cup. Rare af. 12/10 would hug until someone stopped me https://t.co/tvVDY0G911,Michelangelope,12/10,https://pbs.twimg.com/media/CeznK6IWEAEFUPq.jpg,1,Chihuahua,2110,5578
2016-03-30 01:07:18,"<a href=""http://twitter.com/download/iphone"" rel=""nofollow"">Twitter for iPhone</a>",This is Calbert. He forgot to clear his Google search history. 9/10 rookie mistake Calbert https://t.co/jRm5J3YCmj,Calbert,9/10,https://pbs.twimg.com/media/CewgnHAXEAAdbld.jpg,1,Brittany_spaniel,1166,4094
2016-03-29 23:29:14,"<a href=""http://twitter.com/download/iphone"" rel=""nofollow"">Twitter for iPhone</a>",This is Curtis. He's an Albino Haberdasher. Terrified of dandelions. They really spook him up. 10/10 it'll be ok pup https://t.co/s8YcfZrWhK,Curtis,10/10,https://pbs.twimg.com/media/CewKKiOWwAIe3pR.jpg,1,Great_Pyrenees,1595,4503
2016-03-29 00:12:05,"<a href=""http://twitter.com/download/iphone"" rel=""nofollow"">Twitter for iPhone</a>",Here are two lil cuddly puppers. Both 12/10 would snug like so much https://t.co/zO4eb7C4tG,None,12/10,https://pbs.twimg.com/media/CerKYG8WAAM1aE-.jpg,1,Norfolk_terrier,1038,3938
2016-03-28 01:10:13,"<a href=""http://twitter.com/download/iphone"" rel=""nofollow"">Twitter for iPhone</a>","Meet Travis and Flurp. Travis is pretty chill but Flurp can't lie down properly. 10/10 &amp; 8/10
get it together Flurp https://t.co/Akzl5ynMmE",Travis,10/10,https://pbs.twimg.com/media/CemOGNjWQAEoN7R.jpg,1,collie,808,3281
2016-03-28 00:43:43,"<a href=""http://twitter.com/download/iphone"" rel=""nofollow"">Twitter for iPhone</a>",This is Thumas. He hates potted plants. 8/10 wtf Thumas https://t.co/rDVueNIcEi,Thumas,8/10,https://pbs.twimg.com/media/CemIBt4WwAQqhVV.jpg,2,soft-coated_wheaten_terrier,940,3570
2016-03-27 22:14:49,"<a href=""http://twitter.com/download/iphone"" rel=""nofollow"">Twitter for iPhone</a>",Happy Easter from the squad! ðŸ‡ðŸ¶ 13/10 for all https://t.co/YMx4KWJUAB,None,13/10,https://pbs.twimg.com/media/Cell8ikWIAACCJ-.jpg,1,pug,990,2480
2016-03-27 17:25:54,"<a href=""http://twitter.com/download/iphone"" rel=""nofollow"">Twitter for iPhone</a>","I know we only rate dogs, but since it's Easter I guess we could rate a bunny for a change. 10/10 petable as hell https://t.co/O2RlKXigHu",None,10/10,https://pbs.twimg.com/media/Cekj0qwXEAAHcS6.jpg,1,Labrador_retriever,1569,4673
2016-03-27 02:43:58,"<a href=""http://twitter.com/download/iphone"" rel=""nofollow"">Twitter for iPhone</a>",This is Kanu. He's a Freckled Ticonderoga. Simply flawless. 12/10 would perform an elaborate heist to capture https://t.co/7vyAzIURrE,Kanu,12/10,https://pbs.twimg.com/media/CehZ9mLWsAAsn28.jpg,1,Siberian_husky,869,3564
2016-03-27 01:29:02,"<a href=""http://twitter.com/download/iphone"" rel=""nofollow"">Twitter for iPhone</a>",Happy Saturday here's 9 puppers on a bench. 99/90 good work everybody https://t.co/mpvaVxKmc1,None,99/90,https://pbs.twimg.com/media/CehIzzZWQAEyHH5.jpg,1,golden_retriever,829,3062
2016-03-26 16:15:05,"<a href=""http://twitter.com/download/iphone"" rel=""nofollow"">Twitter for iPhone</a>",This is Piper. She would really like that tennis ball core. Super sneaky tongue slip. 12/10 precious af https://t.co/QP6GHi5az9,Piper,12/10,https://pbs.twimg.com/media/CefKBOuWIAAIlKD.jpg,1,Brittany_spaniel,1541,5308
2016-03-25 17:03:49,"<a href=""http://twitter.com/download/iphone"" rel=""nofollow"">Twitter for iPhone</a>",Here we see an extremely rare Bearded Floofmallow. Only a few left in the wild. 11/10 would pet with a purpose https://t.co/jVJJKlPbvq,None,11/10,https://pbs.twimg.com/media/CeaLlAPUMAIcC7U.jpg,1,Great_Pyrenees,1440,4802
2016-03-25 01:35:51,"<a href=""http://twitter.com/download/iphone"" rel=""nofollow"">Twitter for iPhone</a>",This is Lance. Lance doesn't give a shit. 10/10 we should all be more like Lance https://t.co/SqnG9Ap28J,Lance,10/10,https://pbs.twimg.com/media/CeW3MWMWQAEOMbq.jpg,1,whippet,3183,7854
2016-03-24 01:11:29,"<a href=""http://twitter.com/download/iphone"" rel=""nofollow"">Twitter for iPhone</a>",This is Stubert. He just arrived. 10/10 https://t.co/HVGs5aAKAn,Stubert,10/10,https://pbs.twimg.com/media/CeRoBaxWEAABi0X.jpg,1,Labrador_retriever,7602,20378
2016-03-23 19:09:09,"<a href=""http://twitter.com/download/iphone"" rel=""nofollow"">Twitter for iPhone</a>",Please don't send in any more polar bears. We only rate dogs. Thank you... 10/10 https://t.co/83RGhdIQz2,None,10/10,https://pbs.twimg.com/media/CeQVF1eVIAAJaTv.jpg,1,Great_Pyrenees,5616,13474
2016-03-23 15:53:42,"<a href=""http://twitter.com/download/iphone"" rel=""nofollow"">Twitter for iPhone</a>",Say hello to Sunny and Roxy. They pull things out of water together. 10/10 for both https://t.co/88aedAmxcl,Sunny,10/10,https://pbs.twimg.com/media/CePoVTyWsAQEz1g.jpg,1,Labrador_retriever,1367,4531
2016-03-22 02:03:52,"<a href=""http://twitter.com/download/iphone"" rel=""nofollow"">Twitter for iPhone</a>",I can't even comprehend how confused this dog must be right now. 10/10 https://t.co/8AGcQ4hIfK,None,10/10,https://pbs.twimg.com/media/CeHg1klW8AE4YOB.jpg,1,Labrador_retriever,1172,4144
2016-03-22 01:16:55,"<a href=""http://twitter.com/download/iphone"" rel=""nofollow"">Twitter for iPhone</a>","Say hello to Olive and Ruby. They are best buddies. Both 11/10 
1 like = 1 buddy https://t.co/yagmFdKlyL",Olive,11/10,https://pbs.twimg.com/media/CeHWFksXIAAyypp.jpg,2,Shih-Tzu,556,3531
2016-03-21 02:38:34,"<a href=""http://twitter.com/download/iphone"" rel=""nofollow"">Twitter for iPhone</a>",Meet Roosevelt. He's calculating the best case scenario if he drops out instead of doing math hw. 11/10 relatable af https://t.co/QcSIRDpfVg,Roosevelt,11/10,https://pbs.twimg.com/media/CeCfMPDW0AAAEUj.jpg,1,Lakeland_terrier,1101,3095
2016-03-20 01:28:47,"<a href=""http://twitter.com/download/iphone"" rel=""nofollow"">Twitter for iPhone</a>","""Please, no puparazzi"" 11/10 https://t.co/nJIXSPfedK",None,11/10,https://pbs.twimg.com/media/Cd9Fn5QUMAAYMT4.jpg,1,Pembroke,1287,3996
2016-03-19 01:54:56,"<a href=""http://twitter.com/download/iphone"" rel=""nofollow"">Twitter for iPhone</a>",This is Chuckles. He had a balloon but he accidentally let go of it and it floated away. 11/10 hang in there pupper https://t.co/68iNM7B5gW,Chuckles,11/10,https://pbs.twimg.com/media/Cd4CBQFW8AAY3ND.jpg,1,French_bulldog,710,3275
2016-03-19 01:11:29,"<a href=""http://twitter.com/download/iphone"" rel=""nofollow"">Twitter for iPhone</a>",Meet Milo and Amos. They are the best of pals. Both 12/10 would pet at the same time https://t.co/Mv37BHEyyD,Milo,12/10,https://pbs.twimg.com/media/Cd34FClUMAAnvGP.jpg,1,malamute,1561,4960
2016-03-18 14:19:56,"<a href=""http://twitter.com/download/iphone"" rel=""nofollow"">Twitter for iPhone</a>",Say hello to Sora. She's an Egyptian Pumpernickel. Mesmerizing af. 12/10 would bring home to mom https://t.co/PmTR4kxZkq,Sora,12/10,https://pbs.twimg.com/media/Cd1i8qvUkAE-Jlr.jpg,1,Pembroke,606,2937
2016-03-18 02:46:49,"<a href=""http://twitter.com/download/iphone"" rel=""nofollow"">Twitter for iPhone</a>",Here's a brigade of puppers. All look very prepared for whatever happens next. 80/80 https://t.co/0eb7R1Om12,None,80/80,https://pbs.twimg.com/media/CdzETn4W4AAVU5N.jpg,1,soft-coated_wheaten_terrier,636,2529
2016-03-17 22:09:38,"<a href=""http://twitter.com/download/iphone"" rel=""nofollow"">Twitter for iPhone</a>",This is Beemo. He's a Chubberflop mix. 12/10 would cross the world for https://t.co/kzMVMU8HBV,Beemo,12/10,https://pbs.twimg.com/media/CdyE2x1W8AAe0TG.jpg,4,Pembroke,2107,4968
2016-03-17 01:55:02,"<a href=""http://twitter.com/download/iphone"" rel=""nofollow"">Twitter for iPhone</a>",This is Gunner. He's a Figamus Newton. King of the peek-a-boo. Cool jeans. 11/10 https://t.co/ONuBILIYXZ,Gunner,11/10,https://pbs.twimg.com/media/Cdtu3WRUkAAsRVx.jpg,2,Shih-Tzu,580,2308
2016-03-17 01:11:26,"<a href=""http://twitter.com/download/iphone"" rel=""nofollow"">Twitter for iPhone</a>",We ðŸ‘ðŸ» only ðŸ‘ðŸ» rate ðŸ‘ðŸ» dogs. Pls stop sending in non-canines like this Dutch Panda Worm. This is infuriating. 11/10 https://t.co/odfLzBonG2,infuriating,11/10,https://pbs.twimg.com/media/Cdtk414WoAIUG0v.jpg,1,Old_English_sheepdog,1425,4945
2016-03-17 00:58:46,"<a href=""http://twitter.com/download/iphone"" rel=""nofollow"">Twitter for iPhone</a>","The squad is back for St. Patrick's Day! â˜˜ ðŸ’š
13/10 for all https://t.co/OcCDb2bng5",None,13/10,https://pbs.twimg.com/media/Cdth_KyWEAEXH3u.jpg,1,pug,1257,2613
2016-03-16 16:29:35,"<a href=""http://twitter.com/download/iphone"" rel=""nofollow"">Twitter for iPhone</a>",This is Tater. His underbite is fierce af. Doesn't give a damn about your engagement photo. 8/10 https://t.co/nLuPY3pY12,Tater,8/10,https://pbs.twimg.com/media/Cdrtcr-W4AAqi5H.jpg,1,Pekinese,1008,3017
2016-03-16 14:54:24,"<a href=""http://twitter.com/download/iphone"" rel=""nofollow"">Twitter for iPhone</a>",This pupper got her hair chalked for her birthday. Hasn't told her parents yet. Rebellious af. 11/10 very nifty https://t.co/h1OX2mLtxV,None,11/10,https://pbs.twimg.com/media/CdrXp9dWoAAcRfn.jpg,2,toy_poodle,2233,5999
2016-03-16 01:46:45,"<a href=""http://twitter.com/download/iphone"" rel=""nofollow"">Twitter for iPhone</a>",Meet Watson. He's a Suzuki Tickleboop. Leader of a notorious biker gang. Only one ear functional. 12/10 snuggable af https://t.co/R1gLc5vDqG,Watson,12/10,https://pbs.twimg.com/media/CdojYQmW8AApv4h.jpg,2,Pembroke,1215,3250
2016-03-15 21:24:41,"<a href=""http://twitter.com/download/iphone"" rel=""nofollow"">Twitter for iPhone</a>",*lets out a tiny whimper and then collapses* ...12/10 https://t.co/BNdVZEHRow,None,12/10,https://pbs.twimg.com/media/CdnnZhhWAAEAoUc.jpg,2,Chihuahua,1336,3824
2016-03-15 02:25:31,"<a href=""http://twitter.com/download/iphone"" rel=""nofollow"">Twitter for iPhone</a>",This is Olaf. He's gotta be rare. Seems sturdy. Tail is floofy af. 12/10 would do whatever it takes to pet https://t.co/E9jaU59bh9,Olaf,12/10,https://pbs.twimg.com/media/Cdjiqi6XIAIUOg-.jpg,1,chow,1367,3865
2016-03-15 01:48:55,"<a href=""http://twitter.com/download/iphone"" rel=""nofollow"">Twitter for iPhone</a>",This is Cecil. She's a Gigglefloof Poofer. Outdoorsy af. One with nature. 12/10 would strategically capture https://t.co/ijJB0DuOIC,Cecil,12/10,https://pbs.twimg.com/media/CdjaSFCWAAAJZh3.jpg,2,golden_retriever,1204,3593
2016-03-14 23:19:03,"<a href=""http://twitter.com/download/iphone"" rel=""nofollow"">Twitter for iPhone</a>",This is Vince. He's a Gregorian Flapjeck. White spot on legs almost looks like another dog (whoa). 9/10 rad as hell https://t.co/aczGAV2dK4,Vince,9/10,https://pbs.twimg.com/media/Cdi3-f7W8AUOm9T.jpg,1,cocker_spaniel,277,1620
2016-03-14 18:42:20,"<a href=""http://twitter.com/download/iphone"" rel=""nofollow"">Twitter for iPhone</a>",Meet Karma. She's just a head. Lost body during the Second Punic War (unfortunate). Loves to travel 10/10 petable af https://t.co/c6af6nYEPo,Karma,10/10,https://pbs.twimg.com/media/Cdh4pgAW0AEKJ_a.jpg,2,Maltese_dog,665,2420
2016-03-14 16:02:49,"<a href=""http://twitter.com/download/iphone"" rel=""nofollow"">Twitter for iPhone</a>",This is Billy. He sensed a squirrel. 8/10 damn it Billy https://t.co/Yu0K98VZ9A,Billy,8/10,https://pbs.twimg.com/media/CdhUIMSUIAA4wYK.jpg,1,Shetland_sheepdog,788,2855
2016-03-14 03:50:21,"<a href=""http://twitter.com/download/iphone"" rel=""nofollow"">Twitter for iPhone</a>",This is Walker. He's a Butternut Khalifa. Appears fuzzy af. 11/10 would hug for a ridiculous amount of time https://t.co/k6fEWHSALn,Walker,11/10,https://pbs.twimg.com/media/Cdese-zWEAArIqE.jpg,1,Labrador_retriever,647,2615
2016-03-14 02:39:42,"<a href=""http://twitter.com/download/iphone"" rel=""nofollow"">Twitter for iPhone</a>",This is Penny. She's trying on her prom dress. Stunning af 11/10 https://t.co/qcZDZGCapg,Penny,11/10,https://pbs.twimg.com/media/CdecUSzUIAAHCvg.jpg,1,Chihuahua,6567,13755
2016-03-14 02:04:08,"<a href=""http://twitter.com/download/iphone"" rel=""nofollow"">Twitter for iPhone</a>","From left to right:
Cletus, Jerome, Alejandro, Burp, &amp; Titson
None know where camera is. 45/50 would hug all at once https://t.co/sedre1ivTK",None,45/50,https://pbs.twimg.com/media/CdeUKpcWoAAJAWJ.jpg,1,borzoi,721,2634
2016-03-13 23:24:56,"<a href=""http://twitter.com/download/iphone"" rel=""nofollow"">Twitter for iPhone</a>",Meet Rodney. He's a Ukranian Boomchicka. Outside but would like to be inside. Only has one ear (unfortunate) 10/10 https://t.co/FjAj3ggXrR,Rodney,10/10,https://pbs.twimg.com/media/CddvvSwWoAUObQw.jpg,1,Siberian_husky,470,2236
2016-03-13 02:43:08,"<a href=""http://twitter.com/download/iphone"" rel=""nofollow"">Twitter for iPhone</a>",Here's a pupper with magic eyes. Not wearing a seat belt tho (irresponsible af). Very distracting to driver. 9/10 https://t.co/5DLJB4ssvI,None,9/10,https://pbs.twimg.com/media/CdZTgynWwAATZcx.jpg,1,schipperke,1015,3226
2016-03-13 01:57:25,"<a href=""http://twitter.com/download/iphone"" rel=""nofollow"">Twitter for iPhone</a>",Meet Malikai. He was rolling around having fun when he remembered the inevitable heat death of the universe. 10/10 https://t.co/Vd2FqHIIGn,Malikai,10/10,https://pbs.twimg.com/media/CdZI_bpWEAAm1fs.jpg,1,Eskimo_dog,571,1860
2016-03-13 00:24:26,"<a href=""http://twitter.com/download/iphone"" rel=""nofollow"">Twitter for iPhone</a>",This is Mister. He's a wonderful father to his two pups. Heartwarming af. 10/10 for all https://t.co/2KcuJXL2r4,Mister,10/10,https://pbs.twimg.com/media/CdYzwuYUIAAHPkB.jpg,2,golden_retriever,7848,18036
2016-03-12 19:35:15,"<a href=""http://twitter.com/download/iphone"" rel=""nofollow"">Twitter for iPhone</a>",This is Coco. She gets to stay on the Bachelor for another week. Super pumped 11/10 https://t.co/wsCB6LFNxD,Coco,11/10,https://pbs.twimg.com/media/CdXxlFPWwAABaOv.jpg,1,Pomeranian,917,2997
2016-03-12 02:28:06,"<a href=""http://twitter.com/download/iphone"" rel=""nofollow"">Twitter for iPhone</a>",Meet Bear. He's a Beneboop Cumberclap. Extremely unamused. 13/10 I'm in love with this picture https://t.co/uC8kUqAz0W,Bear,13/10,https://pbs.twimg.com/media/CdUGcLMWAAI42q0.jpg,1,Shih-Tzu,765,2768
2016-03-12 01:49:25,"<a href=""http://twitter.com/download/iphone"" rel=""nofollow"">Twitter for iPhone</a>",This is Bobble. He's a Croatian Galifianakis. Hears everything within 400 miles. 11/10 would snug diligently https://t.co/VwDc6PTDzk,Bobble,11/10,https://pbs.twimg.com/media/CdT9n7mW0AQcpZU.jpg,1,Chihuahua,926,3357
2016-03-11 18:18:36,"<a href=""http://twitter.com/download/iphone"" rel=""nofollow"">Twitter for iPhone</a>",This is Oliver. That is his castle. He protects it with his life. He's also squishy af. 10/10 would squish softly https://t.co/oSuEGw0BhX,Oliver,10/10,https://pbs.twimg.com/media/CdSWcc1XIAAXc6H.jpg,2,pug,1520,3929
2016-03-11 04:35:39,"<a href=""http://twitter.com/download/iphone"" rel=""nofollow"">Twitter for iPhone</a>",This is Jebberson. He's the reigning hide and seek world champion. 10/10 hasn't lost his touch https://t.co/VEFkvWCoHF,Jebberson,10/10,https://pbs.twimg.com/media/CdPaEkHW8AA-Wom.jpg,1,Cardigan,1727,4672
2016-03-11 03:22:23,"<a href=""http://twitter.com/download/iphone"" rel=""nofollow"">Twitter for iPhone</a>",Please stop sending in non canines like this Guatemalan Twiggle Bunny. We only rate dogs. Only send in dogs... 11/10 https://t.co/XKhobeGuvT,None,11/10,https://pbs.twimg.com/media/CdPJUWIWIAAIchl.jpg,1,French_bulldog,943,3707
2016-03-11 02:36:57,"<a href=""http://twitter.com/download/iphone"" rel=""nofollow"">Twitter for iPhone</a>",This is Cooper. He basks in the glory of rebellion. 9/10 probably a preteen https://t.co/kDamUfeIpm,Cooper,9/10,https://pbs.twimg.com/media/CdO-6x5W8AENSBJ.jpg,1,Norwich_terrier,1102,2937
2016-03-11 01:56:49,"<a href=""http://twitter.com/download/iphone"" rel=""nofollow"">Twitter for iPhone</a>",This is Remington. He was caught off guard by the magical floating cheese. Spooked af. 10/10 deep breaths pup https://t.co/mhPSADiJmZ,Remington,10/10,https://pbs.twimg.com/media/CdO1u9vWAAApj2V.jpg,1,Staffordshire_bullterrier,610,2124
2016-03-10 20:26:26,"<a href=""http://twitter.com/download/iphone"" rel=""nofollow"">Twitter for iPhone</a>",Everybody stop what you're doing and watch this video. Frank is stuck in a loop. 13/10 (Vid by @klbmatty) https://t.co/5AJs8TIV1U,None,13/10,https://pbs.twimg.com/ext_tw_video_thumb/708026062568087553/pu/img/rNhylAwIfb6YthGu.jpg,1,malinois,2166,4799
