timestamp,source,text,name,rating,jpg_url,img_num,dog_breed,retweet_count,favorite_count
2017-08-01 00:17:27,"<a href=""http://twitter.com/download/iphone"" rel=""nofollow"">Twitter for iPhone</a>","This is Tilly. She's just checking pup on you. Hopes you're doing ok. If not, she's available for pats, snugs, boops, the whole bit. 13/10 https://t.co/0Xxu71qeIV",Tilly,13/10,https://pbs.twimg.com/media/DGGmoV4XsAAUL6n.jpg,1,Chihuahua,6514,33819
2017-07-31 00:18:03,"<a href=""http://twitter.com/download/iphone"" rel=""nofollow"">Twitter for iPhone</a>",This is Archie. He is a rare Norwegian Pouncing Corgo. Lives in the tall grass. You never know when one may strike. 12/10 https://t.co/wUnZnhtVJB,Archie,12/10,https://pbs.twimg.com/media/DGBdLU1WsAANxJ9.jpg,1,Chihuahua,4328,25461
2017-07-29 16:00:24,"<a href=""http://twitter.com/download/iphone"" rel=""nofollow"">Twitter for iPhone</a>","This is Franklin. He would like you to stop calling him ""cute."" He is a very fierce shark and should be respected as such. 12/10 #BarkWeek https://t.co/AtUZn91f7f",Franklin,12/10,https://pbs.twimg.com/media/DF6hr6BUMAAzZgT.jpg,2,basset,9774,41048
2017-07-29 00:08:17,"<a href=""http://twitter.com/download/iphone"" rel=""nofollow"">Twitter for iPhone</a>",Here we have a majestic great white breaching off South Africa's coast. Absolutely h*ckin breathtaking. 13/10 (IG: tucker_marlo) #BarkWeek https://t.co/kQ04fDDRmh,None,13/10,https://pbs.twimg.com/media/DF3HwyEWsAABqE6.jpg,1,Chesapeake_Bay_retriever,3261,20562
2017-07-28 16:27:12,"<a href=""http://twitter.com/download/iphone"" rel=""nofollow"">Twitter for iPhone</a>","Meet Jax. He enjoys ice cream so much he gets nervous around it. 13/10 help Jax enjoy more things by clicking below

https://t.co/Zr4hWfAs1H https://t.co/tVJBRMnhxl",Jax,13/10,https://pbs.twimg.com/media/DF1eOmZXUAALUcq.jpg,1,Appenzeller,2158,12041
2017-07-28 00:22:40,"<a href=""http://twitter.com/download/iphone"" rel=""nofollow"">Twitter for iPhone</a>",When you watch your owner call another dog a good boy but then they turn back to you and say you're a great boy. 13/10 https://t.co/v0nONBcwxq,None,13/10,https://pbs.twimg.com/media/DFyBahAVwAAhUTd.jpg,2,Pomeranian,16716,56848
2017-07-27 16:25:51,"<a href=""http://twitter.com/download/iphone"" rel=""nofollow"">Twitter for iPhone</a>",This is Zoey. She doesn't want to be one of the scary sharks. Just wants to be a snuggly pettable boatpet. 13/10 #BarkWeek https://t.co/9TwLuAGH0b,Zoey,13/10,https://pbs.twimg.com/media/DFwUU__XcAEpyXI.jpg,1,Irish_terrier,4429,28226
2017-07-26 15:59:51,"<a href=""http://twitter.com/download/iphone"" rel=""nofollow"">Twitter for iPhone</a>",This is Cassie. She is a college pup. Studying international doggo communication and stick theory. 14/10 so elegant much sophisticate https://t.co/t1bfwz5S2A,Cassie,14/10,https://pbs.twimg.com/media/DFrEyVuW0AAO3t9.jpg,1,Pembroke,7711,32467
2017-07-26 00:31:25,"<a href=""http://twitter.com/download/iphone"" rel=""nofollow"">Twitter for iPhone</a>",This is Koda. He is a South Australian deckshark. Deceptively deadly. Frighteningly majestic. 13/10 would risk a petting #BarkWeek https://t.co/dVPW0B0Mme,Koda,13/10,https://pbs.twimg.com/media/DFnwSY4WAAAMliS.jpg,1,Samoyed,7624,31166
2017-07-25 16:11:53,"<a href=""http://twitter.com/download/iphone"" rel=""nofollow"">Twitter for iPhone</a>",This is Bruno. He is a service shark. Only gets out of the water to assist you. 13/10 terrifyingly good boy https://t.co/u1XPQMl29g,Bruno,13/10,https://pbs.twimg.com/media/DFl99B1WsAITKsg.jpg,1,French_bulldog,5156,28268
2017-07-25 01:55:32,"<a href=""http://twitter.com/download/iphone"" rel=""nofollow"">Twitter for iPhone</a>",Here's a puppo that seems to be on the fence about something haha no but seriously someone help her. 13/10 https://t.co/BxvuXk0UCm,None,13/10,https://pbs.twimg.com/media/DFi579UWsAAatzw.jpg,1,Pembroke,8538,38818
2017-07-25 00:10:02,"<a href=""http://twitter.com/download/iphone"" rel=""nofollow"">Twitter for iPhone</a>",This is Ted. He does his best. Sometimes that's not enough. But it's ok. 12/10 would assist https://t.co/f8dEDcrKSR,Ted,12/10,https://pbs.twimg.com/media/DFihzFfXsAYGDPR.jpg,1,French_bulldog,4735,27672
2017-07-24 17:02:04,"<a href=""http://twitter.com/download/iphone"" rel=""nofollow"">Twitter for iPhone</a>",This is Stuart. He's sporting his favorite fanny pack. Secretly filled with bones only. 13/10 puppared puppo #BarkWeek https://t.co/y70o6h3isq,Stuart,13/10,https://pbs.twimg.com/media/DFg_2PVW0AEHN3p.jpg,1,golden_retriever,2321,15359
2017-07-24 00:19:32,"<a href=""http://twitter.com/download/iphone"" rel=""nofollow"">Twitter for iPhone</a>",This is Oliver. You're witnessing one of his many brutal attacks. Seems to be playing with his victim. 13/10 fr*ckin frightening #BarkWeek https://t.co/WpHvrQedPb,Oliver,13/10,https://pbs.twimg.com/ext_tw_video_thumb/889278779352338437/pu/img/VlbFB3v8H8VwzVNY.jpg,1,whippet,5637,25652
2017-07-23 00:22:39,"<a href=""http://twitter.com/download/iphone"" rel=""nofollow"">Twitter for iPhone</a>",This is Jim. He found a fren. Taught him how to sit like the good boys. 12/10 for both https://t.co/chxruIOUJN,Jim,12/10,https://pbs.twimg.com/media/DFYRgsOUQAARGhO.jpg,1,golden_retriever,4709,29611
2017-07-22 16:56:37,"<a href=""http://twitter.com/download/iphone"" rel=""nofollow"">Twitter for iPhone</a>",This is Zeke. He has a new stick. Very proud of it. Would like you to throw it for him without taking it. 13/10 would do my best https://t.co/HTQ77yNQ5K,Zeke,13/10,https://pbs.twimg.com/media/DFWra-3VYAA2piG.jpg,1,golden_retriever,4559,26080
2017-07-22 00:23:06,"<a href=""http://twitter.com/download/iphone"" rel=""nofollow"">Twitter for iPhone</a>",This is Ralphus. He's powering up. Attempting maximum borkdrive. 13/10 inspirational af https://t.co/YnYAFCTTiK,Ralphus,13/10,https://pbs.twimg.com/media/DFTH_O-UQAACu20.jpg,3,Siberian_husky,3732,20290
2017-07-20 16:49:33,"<a href=""http://twitter.com/download/iphone"" rel=""nofollow"">Twitter for iPhone</a>",This is Gerald. He was just told he didn't get the job he interviewed for. A h*ckin injustice. 12/10 didn't want the job anyway https://t.co/DK7iDPfuRX,Gerald,12/10,https://pbs.twimg.com/media/DFMWn56WsAAkA7B.jpg,1,French_bulldog,3653,22201
2017-07-19 16:06:48,"<a href=""http://twitter.com/download/iphone"" rel=""nofollow"">Twitter for iPhone</a>",This is Jeffrey. He has a monopoly on the pool noodles. Currently running a 'boop for two' midweek sale. 13/10 h*ckin strategic https://t.co/PhrUk20Q64,Jeffrey,13/10,https://pbs.twimg.com/media/DFHDQBbXgAEqY7t.jpg,1,basset,5609,30779
2017-07-19 00:47:34,"<a href=""http://twitter.com/download/iphone"" rel=""nofollow"">Twitter for iPhone</a>",This is Canela. She attempted some fancy porch pics. They were unsuccessful. 13/10 someone help her https://t.co/cLyzpcUcMX,Canela,13/10,https://pbs.twimg.com/media/DFDw2tyUQAAAFke.jpg,2,Pembroke,18781,69871
2017-07-18 16:08:03,"<a href=""http://twitter.com/download/iphone"" rel=""nofollow"">Twitter for iPhone</a>",You may not have known you needed to see this today. 13/10 please enjoy (IG: emmylouroo) https://t.co/WZqNqygEyV,None,13/10,https://pbs.twimg.com/ext_tw_video_thumb/887343120832229379/pu/img/6HSuFrW1lzI_9Mht.jpg,1,Mexican_hairless,10737,34222
2017-07-18 00:07:08,"<a href=""http://twitter.com/download/iphone"" rel=""nofollow"">Twitter for iPhone</a>",This... is a Jubilant Antarctic House Bear. We only rate dogs. Please only send dogs. Thank you... 12/10 would suffocate in floof https://t.co/4Ad1jzJSdp,None,12/10,https://pbs.twimg.com/media/DE-eAq6UwAA-jaE.jpg,1,Samoyed,6167,31061
2017-07-17 16:17:36,"<a href=""http://twitter.com/download/iphone"" rel=""nofollow"">Twitter for iPhone</a>",This is Maya. She's very shy. Rarely leaves her cup. 13/10 would find her an environment to thrive in https://t.co/I6oNy0CgiT,Maya,13/10,https://pbs.twimg.com/media/DE8yicJW0AAAvBJ.jpg,2,Chihuahua,8084,35859
2017-07-16 23:58:41,"<a href=""http://twitter.com/download/iphone"" rel=""nofollow"">Twitter for iPhone</a>","This is Mingus. He's a wonderful father to his smol pup. Confirmed 13/10, but he needs your help

https://t.co/bVi0Yr4Cff https://t.co/ISvKOSkd5b",Mingus,13/10,https://pbs.twimg.com/media/DE5Se8FXcAAJFx4.jpg,1,kuvasz,3443,12306
2017-07-15 23:25:31,"<a href=""http://twitter.com/download/iphone"" rel=""nofollow"">Twitter for iPhone</a>",This is Roscoe. Another pupper fallen victim to spontaneous tongue ejections. Get the BlepiPen immediate. 12/10 deep breaths Roscoe https://t.co/RGE08MIJox,Roscoe,12/10,https://pbs.twimg.com/media/DE0BTnQUwAApKEH.jpg,1,French_bulldog,3316,21524
2017-07-15 16:17:19,"<a href=""http://twitter.com/download/iphone"" rel=""nofollow"">Twitter for iPhone</a>",This is Waffles. His doggles are pupside down. Unsure how to fix. 13/10 someone assist Waffles https://t.co/xZDA9Qsq1O,Waffles,13/10,https://pbs.twimg.com/media/DEyfTG4UMAE4aE9.jpg,1,pug,6523,28469
2017-07-14 22:10:11,"<a href=""http://twitter.com/download/iphone"" rel=""nofollow"">Twitter for iPhone</a>",Viewer discretion advised. This is Jimbo. He will rip ur finger right h*ckin off. Other dog clearly an accessory. 12/10 pls pet with caution https://t.co/BuveP0uMF1,Jimbo,12/10,https://pbs.twimg.com/media/DEumeWWV0AA-Z61.jpg,1,Blenheim_spaniel,7097,33382
2017-07-13 15:58:47,"<a href=""http://twitter.com/download/iphone"" rel=""nofollow"">Twitter for iPhone</a>",This is Maisey. She fell asleep mid-excavation. Happens to the best of us. 13/10 would pat noggin approvingly https://t.co/tp1kQ8i9JF,Maisey,13/10,https://pbs.twimg.com/media/DEoH3yvXgAAzQtS.jpg,1,pug,6683,36689
2017-07-12 16:03:00,"<a href=""http://twitter.com/download/iphone"" rel=""nofollow"">Twitter for iPhone</a>",Here we have a corgi undercover as a malamute. Pawbably doing important investigative work. Zero control over tongue happenings. 13/10 https://t.co/44ItaMubBf,None,13/10,https://pbs.twimg.com/media/DEi_N9qXYAAgEEw.jpg,4,malamute,4556,22367
2017-07-12 00:01:00,"<a href=""http://twitter.com/download/iphone"" rel=""nofollow"">Twitter for iPhone</a>","This is Earl. He found a hat. Nervous about what you think of it. 12/10 it's delightful, Earl https://t.co/MYJvdlNRVa",Earl,12/10,https://pbs.twimg.com/media/DEfjEaNXkAAtPlj.jpg,1,Italian_greyhound,16439,68152
2017-07-11 20:47:12,"<a href=""http://twitter.com/download/iphone"" rel=""nofollow"">Twitter for iPhone</a>",This is Lola. It's her first time outside. Must test the earth and taste the atmosphere. 13/10 you're doing great Lola https://t.co/74TKAUsLkO,Lola,13/10,https://pbs.twimg.com/media/DEe2tZXXkAAwyX3.jpg,1,chow,6096,28514
2017-07-11 00:00:02,"<a href=""http://twitter.com/download/iphone"" rel=""nofollow"">Twitter for iPhone</a>",This is Kevin. He's just so happy. 13/10 what is your secret Kevin https://t.co/1r4MFCbCX5,Kevin,13/10,https://pbs.twimg.com/media/DEaZQkfXUAEC7qB.jpg,1,pug,5100,24765
2017-07-10 15:58:53,"<a href=""http://twitter.com/download/iphone"" rel=""nofollow"">Twitter for iPhone</a>","I present to you, Pup in Hat. Pup in Hat is great for all occasions. Extremely versatile. Compact as h*ck. 14/10 (IG: itselizabethgales) https://t.co/vvBOcC2VdC",None,14/10,https://pbs.twimg.com/media/DEYrIZwWsAA2Wo5.jpg,1,Pembroke,5856,27478
2017-07-09 21:29:42,"<a href=""http://twitter.com/download/iphone"" rel=""nofollow"">Twitter for iPhone</a>",Meet Yogi. He doesn't have any important dog meetings today he just enjoys looking his best at all times. 12/10 for dangerously dapper doggo https://t.co/YSI00BzTBZ,Yogi,12/10,https://pbs.twimg.com/media/DEUtQbzW0AUTv_o.jpg,1,German_shepherd,3128,20771
2017-07-09 00:00:04,"<a href=""http://twitter.com/download/iphone"" rel=""nofollow"">Twitter for iPhone</a>",This is Noah. He can't believe someone made this mess. Got the vacuum out for you though. Offered to help clean pup. 12/10 super good boy https://t.co/V85xujjDDY,Noah,12/10,https://pbs.twimg.com/media/DEQGFgAXUAAEvfi.jpg,1,Doberman,3586,22349
2017-07-08 00:28:19,"<a href=""http://twitter.com/download/iphone"" rel=""nofollow"">Twitter for iPhone</a>","This is Bella. She hopes her smile made you smile. If not, she is also offering you her favorite monkey. 13.5/10 https://t.co/qjrljjt948",Bella,5/10,https://pbs.twimg.com/media/DELC9dZXUAADqUk.jpg,1,golden_retriever,10407,46860
2017-07-07 16:22:55,"<a href=""http://twitter.com/download/iphone"" rel=""nofollow"">Twitter for iPhone</a>",Meet Grizzwald. He may be the floofiest floofer I ever did see. Lost eyes saving a schoolbus from a volcano erpuption. 13/10 heroic as h*ck https://t.co/rf661IFEYP,Grizzwald,13/10,https://pbs.twimg.com/media/DEJT3FeXoAAtwUy.jpg,1,chow,3825,22986
2017-07-07 00:17:54,"<a href=""http://twitter.com/download/iphone"" rel=""nofollow"">Twitter for iPhone</a>","Please only send dogs. We don't rate mechanics, no matter how h*ckin good. Thank you... 13/10 would sneak a pat https://t.co/Se5fZ9wp5E",None,13/10,https://pbs.twimg.com/media/DEF2-_hXoAAs62q.jpg,2,golden_retriever,6949,37914
2017-07-06 15:58:11,"<a href=""http://twitter.com/download/iphone"" rel=""nofollow"">Twitter for iPhone</a>",This is Rusty. He wasn't ready for the first pic. Clearly puppared for the second. 13/10 confirmed great boy https://t.co/tyER0KpdXj,Rusty,13/10,https://pbs.twimg.com/media/DEEEnIqXYAAiJh_.jpg,1,Eskimo_dog,4122,24445
2017-07-06 00:46:41,"<a href=""http://twitter.com/download/iphone"" rel=""nofollow"">Twitter for iPhone</a>",This is Gus. He's quite the cheeky pupper. Already perfected the disinterested wink. 12/10 would let steal my girl https://t.co/D43I96SlVu,Gus,12/10,https://pbs.twimg.com/media/DEAz_HHXsAA-p_z.jpg,1,Labrador_retriever,5134,28903
2017-07-05 15:48:34,"<a href=""http://twitter.com/download/iphone"" rel=""nofollow"">Twitter for iPhone</a>",This is Stanley. He has his first swim lesson today. Doggle straps adjusted. Ready to go. 13/10 Phelps is nervous (IG: stanleythe_corgi) https://t.co/Nx52PGwH94,Stanley,13/10,https://pbs.twimg.com/media/DD-40X3WAAAJPU5.jpg,1,Pembroke,6342,28382
2017-07-04 16:01:23,"<a href=""http://twitter.com/download/iphone"" rel=""nofollow"">Twitter for iPhone</a>",This is Alfy. You're witnessing his first watermelon experience. I think it was a success. 13/10 happy 4th Alfy ðŸ‡ºðŸ‡¸ https://t.co/fYP5RlutfA,Alfy,13/10,https://pbs.twimg.com/media/DD5yKdPW0AArzX8.jpg,1,golden_retriever,12118,45880
2017-07-03 16:04:48,"<a href=""http://twitter.com/download/iphone"" rel=""nofollow"">Twitter for iPhone</a>",This is Rey. He's a Benebop Cumberfloof. 12/10 dangerously pettable https://t.co/503CgWbhxQ,Rey,12/10,https://pbs.twimg.com/media/DD0pWm9XcAAeSBL.jpg,1,Weimaraner,3533,24773
2017-07-03 00:11:11,"<a href=""http://twitter.com/download/iphone"" rel=""nofollow"">Twitter for iPhone</a>",This is Gary. He couldn't miss this puppertunity for a selfie. Flawless focusing skills. 13/10 would boop intensely https://t.co/7CSWCl8I6s,Gary,13/10,https://pbs.twimg.com/media/DDxPFwbWAAEbVVR.jpg,1,Saluki,11099,51522
2017-07-02 15:32:16,"<a href=""http://twitter.com/download/iphone"" rel=""nofollow"">Twitter for iPhone</a>","Here is a pupper approaching maximum borkdrive. Zooming at never before seen speeds. 14/10 paw-inspiring af 
(IG: puffie_the_chow) https://t.co/ghXBIIeQZF",a,14/10,https://pbs.twimg.com/ext_tw_video_thumb/881535971568889856/pu/img/9bawiZ--8FKywTkz.jpg,1,Samoyed,16570,50199
2017-06-30 19:35:32,"<a href=""http://twitter.com/download/iphone"" rel=""nofollow"">Twitter for iPhone</a>",Ugh not again. We only rate dogs. Please don't send in well-dressed  floppy-tongued street penguins. Dogs only please. Thank you... 12/10 https://t.co/WiAMbTkDPf,None,12/10,https://pbs.twimg.com/media/DDl8zzJW0AAisCJ.jpg,1,Pembroke,3989,21734
2017-06-29 16:39:47,"<a href=""http://twitter.com/download/iphone"" rel=""nofollow"">Twitter for iPhone</a>",This is Bella. She had her first beach experience this morning. Complete success. 12/10 would perform a sandy boop https://t.co/4VsFysDmiw,Bella,12/10,https://pbs.twimg.com/media/DDgK-J4XUAIEV9W.jpg,1,golden_retriever,6546,29075
2017-06-29 00:27:25,"<a href=""http://twitter.com/download/iphone"" rel=""nofollow"">Twitter for iPhone</a>",Meet Jesse. He's a Fetty Woof. His tongue ejects without warning. A true bleptomaniac. 12/10 would snug well https://t.co/fUod0tVmvK,Jesse,12/10,https://pbs.twimg.com/media/DDcscbXU0AIfDzs.jpg,1,Chihuahua,4436,27640
2017-06-28 16:09:20,"<a href=""http://twitter.com/download/iphone"" rel=""nofollow"">Twitter for iPhone</a>",Please don't send in photos without dogs in them. We're not @porch_rates. Insubordinate and churlish. Pretty good porch tho 11/10 https://t.co/HauE8M3Bu4,None,11/10,https://pbs.twimg.com/media/DDa6ckbXgAAM1vV.jpg,1,miniature_pinscher,4533,28150
2017-06-28 00:42:13,"<a href=""http://twitter.com/download/iphone"" rel=""nofollow"">Twitter for iPhone</a>",This is Romeo. He would like to do an entrance. Requesting your immediate assistance. 13/10 https://t.co/Qh5aEkRQm9,Romeo,13/10,https://pbs.twimg.com/media/DDXmPrbWAAEKMvy.jpg,3,basset,3642,22667
2017-06-27 00:10:17,"<a href=""http://twitter.com/download/iphone"" rel=""nofollow"">Twitter for iPhone</a>",This is Bailey. He thinks you should measure ear length for signs of growth instead. 12/10 https://t.co/IxM9IMKQq8,Bailey,12/10,https://pbs.twimg.com/media/DDSVWMvXsAEgmMK.jpg,1,German_short-haired_pointer,3323,23822
2017-06-26 19:07:24,"<a href=""http://twitter.com/download/iphone"" rel=""nofollow"">Twitter for iPhone</a>",This is Duddles. He did an attempt. 13/10 someone help him (vid by Georgia Felici) https://t.co/UDT7ZkcTgY,Duddles,13/10,https://pbs.twimg.com/ext_tw_video_thumb/879415784908390401/pu/img/cX7XI1TnUsseGET5.jpg,1,English_springer,45849,107956
2017-06-25 16:07:47,"<a href=""http://twitter.com/download/iphone"" rel=""nofollow"">Twitter for iPhone</a>",This is Beau. That is Beau's balloon. He takes it everywhere. 13/10 would protect at all costs https://t.co/YDtpCjIPKN,Beau,13/10,https://pbs.twimg.com/media/DDLdUrqXYAMOVzY.jpg,1,vizsla,2812,19317
2017-06-25 00:45:22,"<a href=""http://twitter.com/download/iphone"" rel=""nofollow"">Twitter for iPhone</a>",This is Snoopy. He's a proud #PrideMonthPuppo. Impeccable handwriting for not having thumbs. 13/10 would love back #PrideMonth https://t.co/lNZwgNO4gS,Snoopy,13/10,https://pbs.twimg.com/media/DDIKMXzW0AEibje.jpg,2,Italian_greyhound,4319,19763
2017-06-23 16:00:04,"<a href=""http://twitter.com/download/iphone"" rel=""nofollow"">Twitter for iPhone</a>","Meet Shadow. In an attempt to reach maximum zooming borkdrive, he tore his ACL. Still 13/10 tho. Help him out below

https://t.co/245xJJElsY https://t.co/lUiQH219v6",Shadow,13/10,https://pbs.twimg.com/media/DDBIX9QVYAAohGa.jpg,1,basset,1349,7913
2017-06-23 01:10:23,"<a href=""http://twitter.com/download/iphone"" rel=""nofollow"">Twitter for iPhone</a>",This is Emmy. She was adopted today. Massive round of pupplause for Emmy and her new family. 14/10 for all involved https://t.co/cwtWnHMVpe,Emmy,14/10,https://pbs.twimg.com/media/DC98vABUIAA97pz.jpg,1,French_bulldog,7181,42876
2017-06-22 03:54:17,"<a href=""http://twitter.com/download/iphone"" rel=""nofollow"">Twitter for iPhone</a>",This is Aja. She was just told she's a good dog. Suspicions confirmed. 13/10 would tell again https://t.co/lsPyyAiF1r,Aja,13/10,https://pbs.twimg.com/media/DC5YqoQW0AArOLH.jpg,2,Chesapeake_Bay_retriever,17300,71144
2017-06-21 15:58:08,"<a href=""http://twitter.com/download/iphone"" rel=""nofollow"">Twitter for iPhone</a>",This is Penny. She's both pupset and fired pup. Not pleased w your barbaric attempts at cleanliness. 12/10 would enjoy more shampoo options https://t.co/OYdDlfOGXP,Penny,12/10,https://pbs.twimg.com/media/DC20wEcW0AAf59m.jpg,1,basset,3994,23258
2017-06-21 00:06:44,"<a href=""http://twitter.com/download/iphone"" rel=""nofollow"">Twitter for iPhone</a>","Meet Dante. At first he wasn't a fan of his new raincoat, then he saw his reflection. H*ckin handsome. 13/10 for water resistant good boy https://t.co/SHRTIo5pxc",Dante,13/10,https://pbs.twimg.com/media/DCza_vtXkAQXGpC.jpg,1,Saluki,5414,27907
2017-06-20 16:29:50,"<a href=""http://twitter.com/download/iphone"" rel=""nofollow"">Twitter for iPhone</a>",This is Nelly. He graduated with his dogtorate today. Wants to know if you're proud of him. 12/10 would give congratulatory boop https://t.co/4g4cfj3P4Y,Nelly,12/10,https://pbs.twimg.com/media/DCxyahJWsAAddSC.jpg,1,Pembroke,5880,27755
2017-06-19 16:24:33,"<a href=""http://twitter.com/download/iphone"" rel=""nofollow"">Twitter for iPhone</a>",This is Ginger. She's having a ruff Monday. Too many pupper things going on. H*ckin exhausting. 12/10 would snug passionately https://t.co/j211oCDRs6,Ginger,12/10,https://pbs.twimg.com/media/DCsnnZsVwAEfkyi.jpg,1,bloodhound,3506,21125
2017-06-18 16:57:37,"<a href=""http://twitter.com/download/iphone"" rel=""nofollow"">Twitter for iPhone</a>",This is Benedict. He wants to thank you for this delightful urban walk. Hopes you know he loves you. 13/10 super duper good boy https://t.co/26BXueUgbs,Benedict,13/10,https://pbs.twimg.com/media/DCnll_dUQAAkBdG.jpg,1,golden_retriever,2511,19163
2017-06-17 16:52:05,"<a href=""http://twitter.com/download/iphone"" rel=""nofollow"">Twitter for iPhone</a>","Meet Venti, a seemingly caffeinated puppoccino. She was just informed the weekend would include walks, pats and scritches. 13/10 much excite https://t.co/ejExJFq3ek",Venti,13/10,https://pbs.twimg.com/media/DCiavj_UwAAcXep.jpg,1,Bernese_mountain_dog,4903,28490
2017-06-16 16:11:53,"<a href=""http://twitter.com/download/iphone"" rel=""nofollow"">Twitter for iPhone</a>","This is Goose. He's a womanizer. Cheeky as h*ck, but also deep. Tongue slip game on another level. 13/10 will steal your girl https://t.co/V2WlACRJCN",Goose,13/10,https://pbs.twimg.com/media/DCdH8YpUQAAiEbL.jpg,1,Labrador_retriever,4497,25773
2017-06-15 00:13:52,"<a href=""http://twitter.com/download/iphone"" rel=""nofollow"">Twitter for iPhone</a>",Meet Nugget and Hank. Nugget took Hank's bone. Hank is wondering if you would please return it to him. Both 13/10 would not intervene https://t.co/ogith9ejNj,Nugget,13/10,https://pbs.twimg.com/ext_tw_video_thumb/875144175078957056/pu/img/BRi_l7vUdpb93Knf.jpg,1,Siberian_husky,5081,22185
2017-06-14 16:04:48,"<a href=""http://twitter.com/download/iphone"" rel=""nofollow"">Twitter for iPhone</a>",Guys please stop sending pictures without any dogs in th- oh never mind hello excuse me sir. 12/10 stealthy as h*ck https://t.co/brCQoqc8AW,None,12/10,https://pbs.twimg.com/media/DCSzF3NVoAAPzT4.jpg,2,West_Highland_white_terrier,4922,26022
2017-06-13 17:29:20,"<a href=""http://twitter.com/download/iphone"" rel=""nofollow"">Twitter for iPhone</a>",Meet Cash. He hath acquired a stick. A very good stick tbh. 12/10 would pat head approvingly https://t.co/lZhtizkURD,Cash,12/10,https://pbs.twimg.com/media/DCN85nGUwAAzG_q.jpg,1,Labrador_retriever,4875,28439
2017-06-12 16:06:11,"<a href=""http://twitter.com/download/iphone"" rel=""nofollow"">Twitter for iPhone</a>",This is Jed. He may be the fanciest pupper in the game right now. Knows it too. 13/10 would sign modeling contract https://t.co/0YplNnSMEm,Jed,13/10,https://pbs.twimg.com/media/DCIgSR0XgAANEOY.jpg,1,cocker_spaniel,4308,26651
2017-06-12 00:15:36,"<a href=""http://twitter.com/download/iphone"" rel=""nofollow"">Twitter for iPhone</a>","I can't believe this keeps happening. This, is a birb taking a bath. We only rate dogs. Please only send dogs. Thank you... 12/10 https://t.co/pwY9PQhtP2",None,12/10,https://pbs.twimg.com/media/DCFGtdoXkAEsqIw.jpg,1,flat-coated_retriever,4125,23134
2017-06-11 21:18:31,"<a href=""http://twitter.com/download/iphone"" rel=""nofollow"">Twitter for iPhone</a>","This is Sebastian. He can't see all the colors of the rainbow, but he can see that this flag makes his human happy. 13/10 #PrideMonth puppo https://t.co/XBE0evJZ6V",Sebastian,13/10,https://pbs.twimg.com/media/DCEeLxjXsAAvNSM.jpg,2,Cardigan,11007,35501
2017-06-10 16:39:04,"<a href=""http://twitter.com/download/iphone"" rel=""nofollow"">Twitter for iPhone</a>","We usually don't rate Deck-bound Saskatoon Black Bears, but this one is h*ckin flawless. Sneaky tongue slip too. 13/10 would hug firmly https://t.co/mNuMH9400n",None,13/10,https://pbs.twimg.com/media/DB-UotKXkAEHXVi.jpg,1,Newfoundland,4143,24837
2017-06-09 16:22:42,"<a href=""http://twitter.com/download/iphone"" rel=""nofollow"">Twitter for iPhone</a>","This is Sierra. She's one precious pupper. Absolute 12/10. Been in and out of ICU her whole life. Help Sierra below

https://t.co/Xp01EU3qyD https://t.co/V5lkvrGLdQ",Sierra,12/10,https://pbs.twimg.com/media/DB5HTBGXUAE0TiK.jpg,1,vizsla,1667,7467
2017-06-09 00:02:31,"<a href=""http://twitter.com/download/iphone"" rel=""nofollow"">Twitter for iPhone</a>",Here's a very large dog. He has a date later. Politely asked this water person to check if his breath is bad. 12/10 good to go doggo https://t.co/EMYIdoblMR,None,12/10,https://pbs.twimg.com/media/DB1m871XUAAw5vZ.jpg,2,Labrador_retriever,5669,28031
2017-06-08 14:20:41,"<a href=""http://twitter.com/download/iphone"" rel=""nofollow"">Twitter for iPhone</a>","Here are my favorite #dogsatpollingstations 
Most voted for a more consistent walking schedule and to increase daily pats tenfold. All 13/10 https://t.co/17FVMl4VZ5",None,13/10,https://pbs.twimg.com/media/DBzhx0PWAAEhl0E.jpg,3,pug,3884,15029
2017-06-08 01:06:27,"<a href=""http://twitter.com/download/iphone"" rel=""nofollow"">Twitter for iPhone</a>",This is Monkey. She's supporting owners everywhere with her fancy #PrideMonth bandana. 13/10 love is love is love... https://t.co/lUcpnZDPz9,Monkey,13/10,https://pbs.twimg.com/media/DBwr_hzXkAEnZBW.jpg,1,cocker_spaniel,3911,21309
