timestamp,source,text,name,rating,jpg_url,img_num,dog_breed,retweet_count,favorite_count
2016-12-25 17:00:08,"<a href=""http://twitter.com/download/iphone"" rel=""nofollow"">Twitter for iPhone</a>",This is Tyr. He is disgusted by holiday traffic. Just trying to get to Christmas brunch on time. 12/10 hurry up pup https://t.co/syuTXARdtN,Tyr,12/10,https://pbs.twimg.com/media/C0iX8OOVEAEIpMC.jpg,1,toy_terrier,2276,8865
2016-12-25 16:00:16,"<a href=""http://twitter.com/download/iphone"" rel=""nofollow"">Twitter for iPhone</a>",This is Bauer. He had nothing to do with the cookies that disappeared. 13/10 very good boy https://t.co/AIMF8ouzvl,Bauer,13/10,https://pbs.twimg.com/media/C0iKPZIXUAAbDYV.jpg,1,golden_retriever,8503,23337
2016-12-24 22:04:54,"<a href=""http://twitter.com/download/iphone"" rel=""nofollow"">Twitter for iPhone</a>",This is Swagger. He's the Cleveland Browns ambassador. Hype as h*ck after that first win today. 10/10 https://t.co/lXFM1l22bG,Swagger,10/10,https://pbs.twimg.com/media/C0eUHfWUAAANEYr.jpg,1,bull_mastiff,2191,8380
2016-12-24 17:18:34,"<a href=""http://twitter.com/download/iphone"" rel=""nofollow"">Twitter for iPhone</a>",This is Brandi and Harley. They are practicing their caroling for later. Both 12/10 festive af https://t.co/AbBDuGZUpp,Brandi,12/10,https://pbs.twimg.com/media/C0dSk98WEAALyya.jpg,1,Irish_setter,1665,7373
2016-12-23 19:00:19,"<a href=""http://twitter.com/download/iphone"" rel=""nofollow"">Twitter for iPhone</a>",This is Moe. He's a fetty woof. Got a cardboard cutout of himself for Christmas. 13/10 inspirational af https://t.co/gCnAeL2mvT,Moe,13/10,https://pbs.twimg.com/media/C0YgO3DW8AAz98O.jpg,2,golden_retriever,4252,15224
2016-12-22 17:23:53,"<a href=""http://twitter.com/download/iphone"" rel=""nofollow"">Twitter for iPhone</a>",Say hello to Ted. He accidentally opened the front facing camera. 11/10 h*ckin unpupared https://t.co/sIB5C6FDop,Ted,11/10,https://pbs.twimg.com/media/C0TAnZIUAAAADKs.jpg,1,Staffordshire_bullterrier,1647,8102
2016-12-22 01:24:33,"<a href=""http://twitter.com/download/iphone"" rel=""nofollow"">Twitter for iPhone</a>",This is Halo. She likes watermelon. 13/10 https://t.co/TZkiQZqwA6,Halo,13/10,https://pbs.twimg.com/media/C0PlCQjXAAA9TIh.jpg,1,Pekinese,1884,8429
2016-12-21 17:39:46,"<a href=""http://twitter.com/download/iphone"" rel=""nofollow"">Twitter for iPhone</a>",This is Augie. He's a savage. Doesn't give a h*ck about your garden. Still 10/10 would forgive then pet https://t.co/IU8S0n4oxn,Augie,10/10,https://pbs.twimg.com/media/C0N6opSXAAAkCtN.jpg,1,beagle,3650,14265
2016-12-21 01:44:13,"<a href=""http://twitter.com/download/iphone"" rel=""nofollow"">Twitter for iPhone</a>",This is Craig. That's actually a normal sized fence he's stuck on. H*ckin massive pupper. 11/10 someone help him https://t.co/aAUXzoxaBy,Craig,11/10,https://pbs.twimg.com/media/C0Kf9PtWQAEW4sE.jpg,1,Pembroke,7444,23302
2016-12-19 23:06:23,"<a href=""http://twitter.com/download/iphone"" rel=""nofollow"">Twitter for iPhone</a>","Meet Sam. She smiles 24/7 &amp; secretly aspires to be a reindeer. 
Keep Sam smiling by clicking and sharing this link:
https://t.co/98tB8y7y7t https://t.co/LouL5vdvxx",Sam,24/7,https://pbs.twimg.com/media/C0EyPZbXAAAceSc.jpg,1,golden_retriever,1655,5927
2016-12-19 17:14:23,"<a href=""http://twitter.com/download/iphone"" rel=""nofollow"">Twitter for iPhone</a>","This is Hunter. He just found out he needs braces. Requesting an orthodogtist stat. 11/10 you're fine Hunter, everything's fine https://t.co/zW1o0W4AYV",Hunter,11/10,https://pbs.twimg.com/media/C0DhpcrUAAAnx88.jpg,1,flat-coated_retriever,2090,10093
2016-12-19 01:26:42,"<a href=""http://twitter.com/download/iphone"" rel=""nofollow"">Twitter for iPhone</a>",This is Pavlov. His floatation device has failed him. He's quite pupset about it. 11/10 would rescue https://t.co/MXd0AGDsRJ,Pavlov,11/10,https://pbs.twimg.com/media/C0AIwgVXAAAc1Ig.jpg,1,malamute,3057,12192
2016-12-18 00:43:57,"<a href=""http://twitter.com/download/iphone"" rel=""nofollow"">Twitter for iPhone</a>",This is Phil. He's a father. A very good father too. 13/10 everybody loves Phil https://t.co/9p6ECXJMMu,Phil,13/10,https://pbs.twimg.com/media/Cz61ZD4W8AAcJEU.jpg,1,malamute,13369,39640
2016-12-17 22:43:27,"<a href=""http://twitter.com/download/iphone"" rel=""nofollow"">Twitter for iPhone</a>","This is Gus. He likes to be close to you, which is good because you want to be close to Gus. 12/10 would boop then pet https://t.co/DrsrQkEfnb",Gus,12/10,https://pbs.twimg.com/media/Cz6Z0DgWIAAfdvp.jpg,1,Staffordshire_bullterrier,3901,16380
2016-12-17 00:38:52,"<a href=""http://twitter.com/download/iphone"" rel=""nofollow"">Twitter for iPhone</a>","Please only send in dogs. We only rate dogs, not seemingly heartbroken ewoks. Thank you... still 10/10 would console https://t.co/HIraYS1Bzo",None,10/10,https://pbs.twimg.com/media/Cz1qo05XUAQ4qXp.jpg,1,Norwich_terrier,4521,17250
2016-12-15 17:23:04,"<a href=""http://twitter.com/download/iphone"" rel=""nofollow"">Twitter for iPhone</a>","I call this one ""A Blep by the Sea"" 12/10 https://t.co/EMdnCugNbo",None,12/10,https://pbs.twimg.com/media/Czu9RiwVEAA_Okk.jpg,1,Greater_Swiss_Mountain_dog,1696,7727
2016-12-15 02:14:29,"<a href=""http://twitter.com/download/iphone"" rel=""nofollow"">Twitter for iPhone</a>",This is Kyro. He's a Stratocumulus Flop. Tongue ejects at random. Serious h*ckin condition. Still 12/10 would pet passionately https://t.co/wHu15q2Q6p,Kyro,12/10,https://pbs.twimg.com/media/CzrtWDbWEAAmIhy.jpg,1,Pomeranian,6554,22246
2016-12-14 17:16:53,"<a href=""http://twitter.com/download/iphone"" rel=""nofollow"">Twitter for iPhone</a>","This is Wallace. You said you brushed your teeth but he checked your toothbrush and it was bone dry. 11/10 not pupset, just disappointed https://t.co/nadm8yWZ4h",Wallace,11/10,https://pbs.twimg.com/media/CzpyM41UoAE1b2w.jpg,1,vizsla,4046,14685
2016-12-14 00:57:20,"<a href=""http://twitter.com/download/iphone"" rel=""nofollow"">Twitter for iPhone</a>",This is Ito. He'll be your uber driver tonight. Currently adjusting the mirrors. 13/10 incredibly h*ckin responsible https://t.co/Zrrcw29o13,Ito,13/10,https://pbs.twimg.com/media/CzmSFlKUAAAQOjP.jpg,1,Rottweiler,3536,11271
2016-12-13 02:39:32,"<a href=""http://twitter.com/download/iphone"" rel=""nofollow"">Twitter for iPhone</a>",This is Koda. He dug a hole and then sat in it because why not. Unamused by the bath that followed. 12/10 https://t.co/SQhyqrr8px,Koda,12/10,https://pbs.twimg.com/media/Czhf4XtVQAAIqpd.jpg,2,Airedale,3007,12595
2016-12-12 00:29:28,"<a href=""http://twitter.com/download/iphone"" rel=""nofollow"">Twitter for iPhone</a>",Here we have Burke (pupper) and Dexter (doggo). Pupper wants to be exactly like doggo. Both 12/10 would pet at same time https://t.co/ANBpEYHaho,None,12/10,https://pbs.twimg.com/media/Czb4iFRXgAIUMiN.jpg,1,golden_retriever,2525,9701
2016-12-11 17:31:39,"<a href=""http://twitter.com/download/iphone"" rel=""nofollow"">Twitter for iPhone</a>",This is Cooper. He likes to stick his tongue out at you and then laugh about it. 12/10 quite the jokester https://t.co/O9iGgvfuzl,Cooper,12/10,https://pbs.twimg.com/media/CzaY5UdUoAAC91S.jpg,1,Labrador_retriever,4098,14015
2016-12-10 16:22:02,"<a href=""http://twitter.com/download/iphone"" rel=""nofollow"">Twitter for iPhone</a>",This is Ollie Vue. He was a 3 legged pupper on a mission to overcome everything. This is very hard to write. 14/10 we will miss you Ollie https://t.co/qTRY2qX9y4,Ollie,14/10,https://pbs.twimg.com/media/CzU_YVGUUAA3Xsd.jpg,3,golden_retriever,4288,16236
2016-12-09 06:17:20,"<a href=""http://twitter.com/download/iphone"" rel=""nofollow"">Twitter for iPhone</a>",This is Stephan. He just wants to help. 13/10 such a good boy https://t.co/DkBYaCAg2d,Stephan,13/10,https://pbs.twimg.com/ext_tw_video_thumb/807106774843039744/pu/img/8XZg1xW35Xp2J6JW.jpg,1,Chihuahua,56625,107015
2016-12-08 23:53:08,"<a href=""http://twitter.com/download/iphone"" rel=""nofollow"">Twitter for iPhone</a>",This is Lennon. He's a Boopershnoop Pupperdoop. Quite rare. Exceptionally pettable. 12/10 would definitely boop that shnoop https://t.co/fhgP6vSfhX,Lennon,12/10,https://pbs.twimg.com/media/CzMTcZoXUAEKqEt.jpg,1,golden_retriever,4418,14514
2016-12-07 16:53:43,"<a href=""http://twitter.com/download/iphone"" rel=""nofollow"">Twitter for iPhone</a>",This is Waffles. He's concerned that the dandruff shampoo he just bought is faulty. 11/10 tragic af https://t.co/BCB87qUU0h,Waffles,11/10,https://pbs.twimg.com/media/CzFp3FNW8AAfvV8.jpg,1,vizsla,2752,11363
2016-12-06 19:29:28,"<a href=""http://twitter.com/download/iphone"" rel=""nofollow"">Twitter for iPhone</a>",We only rate dogs. Please stop sending in non-canines like this Freudian Poof Lion. This is incredibly frustrating... 11/10 https://t.co/IZidSrBvhi,incredibly,11/10,https://pbs.twimg.com/media/CzBD7MWVIAA5ptx.jpg,1,chow,1388,7145
2016-12-06 00:32:26,"<a href=""http://twitter.com/download/iphone"" rel=""nofollow"">Twitter for iPhone</a>",This is Major. He put on a tie for his first real walk. Only a little crooked. Can also drool upwards. H*ckin talented. 12/10 https://t.co/Zcwr8LgoO8,Major,12/10,https://pbs.twimg.com/media/Cy8_qt0UUAAHuuN.jpg,1,Norwegian_elkhound,2209,9178
2016-12-05 17:31:15,"<a href=""http://twitter.com/download/iphone"" rel=""nofollow"">Twitter for iPhone</a>",This is Duke. He is not a fan of the pupporazzi. 12/10 https://t.co/SgpBVYIL18,Duke,12/10,https://pbs.twimg.com/ext_tw_video_thumb/805826823359631360/pu/img/yr_fF0TZCR-B70p2.jpg,1,Siberian_husky,2132,7335
2016-12-04 21:14:20,"<a href=""http://twitter.com/download/iphone"" rel=""nofollow"">Twitter for iPhone</a>",This is Zeke the Wonder Dog. He never let that poor man keep his frisbees. One of the Spartans all time greatest receivers. 13/10 RIP Zeke https://t.co/zacX7S6GyJ,Zeke,13/10,https://pbs.twimg.com/media/Cy3IvdZXgAUoEaj.jpg,1,malinois,1905,6368
2016-12-04 00:30:29,"<a href=""http://twitter.com/download/iphone"" rel=""nofollow"">Twitter for iPhone</a>",This is Shooter. He's doing quite the snowy zoom. 12/10 https://t.co/lHy4Xbyhd9,Shooter,12/10,https://pbs.twimg.com/media/CyysDQlVIAAYgrl.jpg,1,Pembroke,1972,8680
2016-12-02 17:27:25,"<a href=""http://twitter.com/download/iphone"" rel=""nofollow"">Twitter for iPhone</a>",This is Django. He accidentally opened the front facing camera. Did him quite the frighten. 12/10 https://t.co/kQVQoOW9NZ,Django,12/10,https://pbs.twimg.com/media/CysBn-lWIAAoRx1.jpg,1,Tibetan_mastiff,4480,15326
2016-11-30 01:31:12,"<a href=""http://twitter.com/download/iphone"" rel=""nofollow"">Twitter for iPhone</a>",This is Diogi. He fell in the pool as soon as he was brought home. Clumsy puppo. 12/10 would pet until dry https://t.co/ZxeRjMKaWt,Diogi,12/10,https://pbs.twimg.com/media/CyeTku-XcAALkBd.jpg,2,miniature_pinscher,3220,11203
2016-11-29 16:33:36,"<a href=""http://twitter.com/download/iphone"" rel=""nofollow"">Twitter for iPhone</a>",Pupper hath acquire enemy. 13/10 https://t.co/ns9qoElfsX,None,13/10,https://pbs.twimg.com/ext_tw_video_thumb/803638023904559104/pu/img/vxm0Htm5iIV7EOAQ.jpg,1,Labrador_retriever,4828,12270
2016-11-28 16:37:19,"<a href=""http://twitter.com/download/iphone"" rel=""nofollow"">Twitter for iPhone</a>",This is Winston. His selfie game is legendary. Will steal your girl with a single snap. 11/10 handsome as h*ck https://t.co/jxQhxoPsgL,Winston,11/10,https://pbs.twimg.com/media/CyXPzXRWgAAvd1j.jpg,1,Pembroke,2887,11207
2016-11-27 19:09:28,"<a href=""http://twitter.com/download/iphone"" rel=""nofollow"">Twitter for iPhone</a>",This is Marley. She's having a ruff day. Pretty pupset. 12/10 would assist https://t.co/yLm7hQ6UXh,Marley,12/10,https://pbs.twimg.com/media/CySpCSHXcAAN-qC.jpg,1,chow,2336,10085
2016-11-26 18:00:13,"<a href=""http://twitter.com/download/iphone"" rel=""nofollow"">Twitter for iPhone</a>",This is Winnie. She's h*ckin ferocious. Dandelion doesn't even see her coming. 12/10 would pet with caution https://t.co/EFfLCP7oQv,Winnie,12/10,https://pbs.twimg.com/media/CyNPmJgXcAECPuB.jpg,1,golden_retriever,2926,9959
2016-11-25 21:37:47,"<a href=""http://twitter.com/download/iphone"" rel=""nofollow"">Twitter for iPhone</a>","Like doggo, like pupper version 2. Both 11/10 https://t.co/9IxWAXFqze",None,11/10,https://pbs.twimg.com/media/CyI3zXgWEAACQfB.jpg,1,Labrador_retriever,1573,7039
2016-11-25 19:55:35,"<a href=""http://twitter.com/download/iphone"" rel=""nofollow"">Twitter for iPhone</a>",This is Loki. He'll do your taxes for you. Can also make room in your budget for all the things you bought today. 12/10 what a puppo https://t.co/5oWrHCWg87,Loki,12/10,https://pbs.twimg.com/media/CyIgaTEVEAA-9zS.jpg,2,Eskimo_dog,3040,10132
2016-11-25 01:18:59,"<a href=""http://twitter.com/download/iphone"" rel=""nofollow"">Twitter for iPhone</a>",This is Ronnie. He hopes you're having a great day. Nifty tongue slip. 12/10 would pat head approvingly https://t.co/4fY2bsAm65,Ronnie,12/10,https://pbs.twimg.com/media/CyEg2AXUsAA1Qpf.jpg,1,Staffordshire_bullterrier,1992,8608
2016-11-23 21:29:33,"<a href=""http://twitter.com/download/iphone"" rel=""nofollow"">Twitter for iPhone</a>",This is Wallace. He'll be your chau-fur this evening. 12/10 eyes on the road Wallace https://t.co/p1RD39XjUe,Wallace,12/10,https://pbs.twimg.com/media/Cx-itFWWIAAZu7l.jpg,1,Pembroke,2391,9141
2016-11-22 20:58:07,"<a href=""http://twitter.com/download/iphone"" rel=""nofollow"">Twitter for iPhone</a>",This is Milo. I would do terrible things for Milo. 13/10 https://t.co/R6wJyC2Tey,Milo,13/10,https://pbs.twimg.com/media/Cx5R8wPVEAALa9r.jpg,1,cocker_spaniel,6961,27386
2016-11-22 17:28:25,"<a href=""http://twitter.com/download/iphone"" rel=""nofollow"">Twitter for iPhone</a>",This is Bones. He's being haunted by another doggo of roughly the same size. 12/10 deep breaths pupper everything's fine https://t.co/55Dqe0SJNj,Bones,12/10,https://pbs.twimg.com/media/Cx4h7zHUsAAqaJd.jpg,1,dalmatian,2429,8992
2016-11-21 17:23:47,"<a href=""http://twitter.com/download/iphone"" rel=""nofollow"">Twitter for iPhone</a>",Say hello to Mauve and Murphy. They're rather h*ckin filthy. Preferred nap over bath. Both 12/10 https://t.co/4UwCTW3lXG,Mauve,12/10,https://pbs.twimg.com/media/CxzXOyBW8AEu_Oi.jpg,2,cocker_spaniel,3214,11701
2016-11-21 01:37:04,"<a href=""http://twitter.com/download/iphone"" rel=""nofollow"">Twitter for iPhone</a>",This is Chef. Chef loves everyone and wants everyone to love each other. 11/10 https://t.co/ILHGs0e6Dm,Chef,11/10,https://pbs.twimg.com/media/Cxv-nkJUoAAhzMt.jpg,1,Pembroke,3495,14685
2016-11-20 17:20:08,"<a href=""http://twitter.com/download/iphone"" rel=""nofollow"">Twitter for iPhone</a>",This is Doc. He takes time out of every day to worship our plant overlords. 12/10 quite the floofer https://t.co/azMneS6Ly5,Doc,12/10,https://pbs.twimg.com/media/CxuM3oZW8AEhO5z.jpg,2,golden_retriever,3265,12456
2016-11-20 00:59:15,"<a href=""http://twitter.com/download/iphone"" rel=""nofollow"">Twitter for iPhone</a>",This is Peaches. She's the ultimate selfie sidekick. Super sneaky tongue slip appreciated. 13/10 https://t.co/pbKOesr8Tg,Peaches,13/10,https://pbs.twimg.com/media/CxqsX-8XUAAEvjD.jpg,3,golden_retriever,2980,17092
2016-11-18 23:35:32,"<a href=""http://twitter.com/download/iphone"" rel=""nofollow"">Twitter for iPhone</a>",This is Sobe. She's a h*ckin happy doggo. Only one leg tho. Must have good balance. 13/10 would smile back https://t.co/OiH8PaOxB1,Sobe,13/10,https://pbs.twimg.com/media/CxlPnoSUcAEXf1i.jpg,1,Border_collie,2506,9390
2016-11-18 01:24:14,"<a href=""http://twitter.com/download/iphone"" rel=""nofollow"">Twitter for iPhone</a>",This is Longfellow (prolly sophisticated). He's a North Appalachian Oatzenjammer. Concerned about wrinkled feets. 12/10 would hug softly https://t.co/bpLuQuxzHZ,Longfellow,12/10,https://pbs.twimg.com/media/Cxge6AdUQAAvXLB.jpg,1,miniature_pinscher,2213,8965
2016-11-17 17:04:16,"<a href=""http://twitter.com/download/iphone"" rel=""nofollow"">Twitter for iPhone</a>",This is Jeffrey. He's quite the jokester. Takes it too far sometimes. Still 11/10 would pet https://t.co/YDtZcAiMAf,Jeffrey,11/10,https://pbs.twimg.com/media/CxeseRgUoAM_SQK.jpg,1,malamute,3227,11065
2016-11-17 01:35:54,"<a href=""http://twitter.com/download/iphone"" rel=""nofollow"">Twitter for iPhone</a>",This is Mister. He only wears the most fashionable af headwear. 11/10 h*ckin stylish https://t.co/BXJFKOVnJm,Mister,11/10,https://pbs.twimg.com/media/CxbX_n2WIAAHaLS.jpg,2,Norfolk_terrier,2863,9058
2016-11-16 17:01:16,"<a href=""http://twitter.com/download/iphone"" rel=""nofollow"">Twitter for iPhone</a>",This is Iroh. He's in a predicament. 12/10 someone help him https://t.co/KJAKO2kXsL,Iroh,12/10,https://pbs.twimg.com/media/CxZiLcLXUAApMVy.jpg,1,Siberian_husky,5203,14712
2016-11-16 16:28:21,"<a href=""http://twitter.com/download/iphone"" rel=""nofollow"">Twitter for iPhone</a>",This is Shadow. He's a firm believer that they're all good dogs. H*ckin passionate about it too. 11/10 I stand with Shadow https://t.co/8yvpacwBcu,Shadow,11/10,https://pbs.twimg.com/media/CxZaqh_WQAA7lY3.jpg,1,West_Highland_white_terrier,1663,8246
2016-11-14 17:03:50,"<a href=""http://twitter.com/download/iphone"" rel=""nofollow"">Twitter for iPhone</a>",This is Cooper. His bow tie was too heavy for the front so he moved it to the side. Balanced af now. 13/10 https://t.co/jG1PAFkB81,Cooper,13/10,https://pbs.twimg.com/media/CxPPnCYWIAAo_ao.jpg,1,Pekinese,2954,11548
2016-11-14 01:18:12,"<a href=""http://twitter.com/download/iphone"" rel=""nofollow"">Twitter for iPhone</a>",Here's a helicopter pupper. He takes off at random. H*ckin hard to control. 12/10 rare af https://t.co/GRWPgNKt2z,None,12/10,https://pbs.twimg.com/media/CxL3IWeVEAAAIE2.jpg,1,American_Staffordshire_terrier,3652,13018
2016-11-12 21:02:38,"<a href=""http://twitter.com/download/iphone"" rel=""nofollow"">Twitter for iPhone</a>",This is Cassie. She steals things. Guilt increases slightly each time. 12/10 would forgive almost immediately https://t.co/Ia19irLwyB,Cassie,12/10,https://pbs.twimg.com/media/CxFzFAAUAAA5C9z.jpg,1,Pembroke,5656,16198
2016-11-12 00:36:46,"<a href=""http://twitter.com/download/iphone"" rel=""nofollow"">Twitter for iPhone</a>",This is Pancake. She loves Batman and winks like a h*ckin champ. 12/10 real crowd pleaser https://t.co/6kqsAjJNhi,Pancake,12/10,https://pbs.twimg.com/media/CxBafisWQAAtJ1X.jpg,2,collie,7726,22328
2016-11-11 00:03:42,"<a href=""http://twitter.com/download/iphone"" rel=""nofollow"">Twitter for iPhone</a>",This is Tyr. He's just checking on you. Nifty af tongue slip. 12/10 would absolutely pet https://t.co/Jgnuiyvq06,Tyr,12/10,https://pbs.twimg.com/media/Cw8JWZ2UsAAJOZ6.jpg,1,Cardigan,2198,8564
2016-11-10 17:02:03,"<a href=""http://twitter.com/download/iphone"" rel=""nofollow"">Twitter for iPhone</a>",Say hello to Romeo. He was just told that it's too cold for the pool. H*ckin nonsense. 11/10 would help fill up https://t.co/6hx7ur6sNI,Romeo,11/10,https://pbs.twimg.com/media/Cw6o1JQXcAAtP78.jpg,1,American_Staffordshire_terrier,3562,13256
2016-11-09 22:49:15,"<a href=""http://twitter.com/download/iphone"" rel=""nofollow"">Twitter for iPhone</a>",Here's a sleepy doggo that requested some assistance. 12/10 would carry everywhere https://t.co/bvkkqOjNDV,None,12/10,https://pbs.twimg.com/media/Cw2uty8VQAAB0pL.jpg,1,cocker_spaniel,2042,8472
2016-11-09 16:22:22,"<a href=""http://twitter.com/download/iphone"" rel=""nofollow"">Twitter for iPhone</a>",This is Snicku. He's having trouble reading because he's a dog. Glasses only helped a little. Nap preferred. 12/10 would snug well https://t.co/cVLUasbKA5,Snicku,12/10,https://pbs.twimg.com/media/Cw1WKu1UQAAvWsu.jpg,1,Pekinese,4861,12334
2016-11-09 00:37:46,"<a href=""http://twitter.com/download/iphone"" rel=""nofollow"">Twitter for iPhone</a>",This is Ruby. She just turned on the news. Officially terrified. 11/10 deep breaths Ruby https://t.co/y5KarNXWXt,Ruby,11/10,https://pbs.twimg.com/media/Cwx99rpW8AMk_Ie.jpg,1,golden_retriever,16628,36177
2016-11-08 22:25:27,"<a href=""http://twitter.com/download/iphone"" rel=""nofollow"">Twitter for iPhone</a>",I didn't believe it at first but now I can see that voter fraud is a serious h*ckin issue. 11/10 https://t.co/7i0bDMbrVN,None,11/10,https://pbs.twimg.com/media/CwxfrguUUAA1cbl.jpg,1,Cardigan,2813,10139
2016-11-08 20:00:55,"<a href=""http://twitter.com/download/iphone"" rel=""nofollow"">Twitter for iPhone</a>",This is Yogi. He's 98% floof. Snuggable af. 12/10 https://t.co/opoXKxmfFm,Yogi,12/10,https://pbs.twimg.com/media/Cww-msrXcAAxm3K.jpg,1,chow,2703,9469
2016-11-08 16:47:50,"<a href=""http://twitter.com/download/iphone"" rel=""nofollow"">Twitter for iPhone</a>",This is Daisy. She's here to make your day better. 13/10 mission h*ckin successful https://t.co/PbgvuD0qIL,Daisy,13/10,https://pbs.twimg.com/media/CwwSaWJWIAASuoY.jpg,1,golden_retriever,4284,12071
2016-11-07 03:14:10,"<a href=""http://twitter.com/download/iphone"" rel=""nofollow"">Twitter for iPhone</a>",Elder doggo does a splash. Both 13/10 incredible stuff https://t.co/gBUDjdEcqz,None,13/10,https://pbs.twimg.com/ext_tw_video_thumb/795464066940764160/pu/img/jPkMMQXdydb7CqFX.jpg,1,golden_retriever,27728,55683
2016-11-06 22:59:35,"<a href=""http://twitter.com/download/iphone"" rel=""nofollow"">Twitter for iPhone</a>",This is Brody. He's trying to make the same face as the football. 12/10 https://t.co/2H4MfOGlpQ,Brody,12/10,https://pbs.twimg.com/media/CwnUUGTWIAE8sFR.jpg,2,golden_retriever,3323,11270
2016-11-04 00:15:59,"<a href=""http://twitter.com/download/iphone"" rel=""nofollow"">Twitter for iPhone</a>",This is Nimbus (like the cloud). He just bought this fancy af duck raincoat. Only protects one ear tho. 12/10 so h*ckin floofy https://t.co/SIQbb8c3AU,Nimbus,12/10,https://pbs.twimg.com/media/CwYJBiHXgAQlvrh.jpg,1,Samoyed,3088,10686
2016-11-02 23:45:19,"<a href=""http://twitter.com/download/iphone"" rel=""nofollow"">Twitter for iPhone</a>",This is Maximus. His face is stuck like that. Tragic really. Great tongue tho. 12/10 would pet firmly https://t.co/xIfrsMNLBR,Maximus,12/10,https://pbs.twimg.com/media/CwS4aqZXUAAe3IO.jpg,1,Labrador_retriever,5711,18910
2016-11-02 16:00:06,"<a href=""http://twitter.com/download/iphone"" rel=""nofollow"">Twitter for iPhone</a>",This is Clark. He was just caught wearing pants. 13/10 game-changing af https://t.co/2Xo19aPrG5,Clark,13/10,https://pbs.twimg.com/media/CwRN8H6WgAASe4X.jpg,1,Old_English_sheepdog,2187,10295
2016-11-01 23:53:02,"<a href=""http://twitter.com/download/iphone"" rel=""nofollow"">Twitter for iPhone</a>",This is Dobby. I can't stop looking at her feet. 12/10 would absolutely snug https://t.co/LhzPWv6rTv,Dobby,12/10,https://pbs.twimg.com/media/CwNwmxvXEAEJ54Z.jpg,1,miniature_pinscher,1908,8926
2016-11-01 17:12:16,"<a href=""http://twitter.com/download/iphone"" rel=""nofollow"">Twitter for iPhone</a>",This is Fiona. She's an extremely mediocre copilot. Very distracting. Wink makes up for all the missed turns. 12/10 https://t.co/aF5MmpvPqN,Fiona,12/10,https://pbs.twimg.com/media/CwMU34YWIAAz1nU.jpg,2,golden_retriever,2786,11953
2016-11-01 03:00:09,"<a href=""http://twitter.com/download/iphone"" rel=""nofollow"">Twitter for iPhone</a>",This is Moreton. He's the Good Boy Who Lived. 13/10 magical as h*ck https://t.co/rLHGx3VAF3,Moreton,13/10,https://pbs.twimg.com/media/CwJR1okWIAA6XMp.jpg,1,Afghan_hound,10723,27597
2016-11-01 02:00:14,"<a href=""http://twitter.com/download/iphone"" rel=""nofollow"">Twitter for iPhone</a>",Meet Dave. It's his favorite day of the year. He gets to fulfill his dream of being a dinosaur. 12/10 inspirational af https://t.co/MgQSdfZGPN,Dave,12/10,https://pbs.twimg.com/media/CwJEIKTWYAAvL-T.jpg,1,Siberian_husky,2763,9677
2016-11-01 01:00:05,"<a href=""http://twitter.com/download/iphone"" rel=""nofollow"">Twitter for iPhone</a>",Oh h*ck look at this spookling right here. Fright level off the charts. 12/10 sufficiently spooked https://t.co/BNy9IIJMb0,None,12/10,https://pbs.twimg.com/media/CwI2XCvXEAEO8mc.jpg,1,basset,9714,22350
2016-11-01 00:00:38,"<a href=""http://twitter.com/download/iphone"" rel=""nofollow"">Twitter for iPhone</a>",This is Tucker. He's out here bustin h*ckin ghosts. 13/10 dedicated af https://t.co/Ap477GhwXt,Tucker,13/10,https://pbs.twimg.com/media/CwIougTWcAAMLyq.jpg,1,golden_retriever,3812,11780
2016-10-31 23:00:11,"<a href=""http://twitter.com/download/iphone"" rel=""nofollow"">Twitter for iPhone</a>","This is Juno. She spooked me up real good, but only to get my attention. Above average handwriting for a dog I think. 11/10 https://t.co/hFxxBCWlwj",Juno,11/10,https://pbs.twimg.com/media/CwIa5CjW8AErZgL.jpg,1,wire-haired_fox_terrier,3338,11001
2016-10-31 21:00:23,"<a href=""http://twitter.com/download/iphone"" rel=""nofollow"">Twitter for iPhone</a>",Say hello to Lily. She's pupset that her costume doesn't fit as well as last year. 12/10 poor puppo https://t.co/YSi6K1firY,Lily,12/10,https://pbs.twimg.com/media/CwH_foYWgAEvTyI.jpg,2,Labrador_retriever,6547,17063
2016-10-31 20:00:05,"<a href=""http://twitter.com/download/iphone"" rel=""nofollow"">Twitter for iPhone</a>",This is Newt. He's a strawberry. 11/10 https://t.co/2VhmlwxA1Q,Newt,11/10,https://pbs.twimg.com/media/CwHxsdYVMAAqGCJ.jpg,1,Lakeland_terrier,2310,7740
2016-10-31 19:00:10,"<a href=""http://twitter.com/download/iphone"" rel=""nofollow"">Twitter for iPhone</a>",This is Benji. He's Air Bud. It's a low effort costume but he pulls it off rather h*ckin well. 12/10 would happily get dunked on https://t.co/IbzT7DJvBo,Benji,12/10,https://pbs.twimg.com/media/CwHj-jGWAAAnsny.jpg,1,golden_retriever,3238,10478
2016-10-31 18:00:14,"<a href=""http://twitter.com/download/iphone"" rel=""nofollow"">Twitter for iPhone</a>",This is Nida. She's a free elf. Waited so long for this day. 11/10 https://t.co/3lE8Izgmkf,Nida,11/10,https://pbs.twimg.com/media/CwHWOZ7W8AAHv8S.jpg,1,Italian_greyhound,1984,6909
