timestamp,source,text,name,rating,jpg_url,img_num,dog_breed,retweet_count,favorite_count
2015-12-16 23:29:14,"<a href=""http://twitter.com/download/iphone"" rel=""nofollow"">Twitter for iPhone</a>",This is the happiest pupper I've ever seen. 10/10 would trade lives with https://t.co/ep8ATEJwRb,the,10/10,https://pbs.twimg.com/media/CWYk0WxWoAAEwRt.jpg,1,Shetland_sheepdog,790,2164
2015-12-16 18:03:28,"<a href=""http://twitter.com/download/iphone"" rel=""nofollow"">Twitter for iPhone</a>",Here we see a Byzantine Rigatoni. Very aerodynamic. No eyes. Actually not windy here they just look like that. 9/10 https://t.co/gzI0m6wXRo,None,9/10,https://pbs.twimg.com/media/CWXaQMBWcAAATDi.jpg,1,English_setter,1033,2981
2015-12-16 04:01:59,"<a href=""http://twitter.com/download/iphone"" rel=""nofollow"">Twitter for iPhone</a>",This is Cooper. He doesn't know how cheese works. Likes the way it feels on his face. Cheeky tongue slip. 11/10 https://t.co/j1zczS0lI5,Cooper,11/10,https://pbs.twimg.com/media/CWUZpydWcAAeipD.jpg,1,malamute,1203,3015
2015-12-16 02:51:45,"<a href=""http://twitter.com/download/iphone"" rel=""nofollow"">Twitter for iPhone</a>",10/10 I'd follow this dog into battle no questions asked https://t.co/ngTNXYQF0L,None,10/10,https://pbs.twimg.com/ext_tw_video_thumb/676957802976419840/pu/img/dCj-qlXo73A5hf6Q.jpg,1,Labrador_retriever,907,2395
2015-12-16 02:19:04,"<a href=""http://twitter.com/download/iphone"" rel=""nofollow"">Twitter for iPhone</a>",This is Tyrus. He's a Speckled Centennial Ticonderoga. Terrified of floating red ball. Nifty bandana. 8/10 v petable https://t.co/HqM3YhCaaa,Tyrus,8/10,https://pbs.twimg.com/media/CWUCGMtWEAAjXnS.jpg,1,Welsh_springer_spaniel,448,1413
2015-12-16 02:08:04,"<a href=""http://twitter.com/download/iphone"" rel=""nofollow"">Twitter for iPhone</a>",This pups goal was to get all four feet as close to each other as possible. Valiant effort 12/10 https://t.co/2mXALbgBTV,None,12/10,https://pbs.twimg.com/media/CWT_lOQWUAAXPaY.jpg,1,Pekinese,426,1844
2015-12-16 01:27:03,"<a href=""http://twitter.com/download/iphone"" rel=""nofollow"">Twitter for iPhone</a>",Here we see a rare pouched pupper. Ample storage space. Looks alert. Jumps at random. Kicked open that door. 8/10 https://t.co/mqvaxleHRz,None,8/10,https://pbs.twimg.com/media/CWT2MUgWIAECWig.jpg,1,Chesapeake_Bay_retriever,5515,13809
2015-12-15 20:40:47,"<a href=""http://twitter.com/download/iphone"" rel=""nofollow"">Twitter for iPhone</a>",Meet Ash. He's just a head now. Lost his body during the Third Crusade. Still in good spirits. 10/10 would pet well https://t.co/NJj2uP0atK,Ash,10/10,https://pbs.twimg.com/media/CWS0q8iU8AE2Srr.jpg,1,Chesapeake_Bay_retriever,808,2294
2015-12-15 17:51:44,"<a href=""http://twitter.com/download/iphone"" rel=""nofollow"">Twitter for iPhone</a>",Finally some constructive political change in this country. 11/10 https://t.co/mvQaETHVSb,None,11/10,https://pbs.twimg.com/media/CWSN-vaXAAA8Ehr.jpg,2,Great_Pyrenees,17605,25124
2015-12-15 17:11:09,"<a href=""http://twitter.com/download/iphone"" rel=""nofollow"">Twitter for iPhone</a>",Say hello to Penny &amp; Gizmo. They are practicing their caroling. The ambition in the room is tangible. 9/10 for both https://t.co/aqBHjjh5VD,Penny,9/10,https://pbs.twimg.com/media/CWSEsO9WwAAX-fZ.jpg,1,Chihuahua,469,1536
2015-12-15 04:19:18,"<a href=""http://twitter.com/download/iphone"" rel=""nofollow"">Twitter for iPhone</a>",I promise this wasn't meant to be a cuteness overload account but ermergerd look at this cozy pupper. 13/10 https://t.co/mpQl2rJjDh,None,13/10,https://pbs.twimg.com/media/CWPUB9TWwAALPPx.jpg,1,Chihuahua,1108,3149
2015-12-15 03:23:14,"<a href=""http://twitter.com/download/iphone"" rel=""nofollow"">Twitter for iPhone</a>",This is Godzilla pupper. He had a ruff childhood &amp; now deflects that pain outward by terrorizing cities. Tragic 9/10 https://t.co/g1tLGkyaxr,Godzilla,9/10,https://pbs.twimg.com/media/CWPHMqKVAAAE78E.jpg,1,whippet,440,1280
2015-12-15 02:23:26,"<a href=""http://twitter.com/download/iphone"" rel=""nofollow"">Twitter for iPhone</a>",This is Bubbles. He kinda resembles a fish. Always makes eye contact with u no matter what. Sneaky tongue slip. 5/10 https://t.co/Nrhvc5tLFT,Bubbles,5/10,https://pbs.twimg.com/media/CWO5gmCUYAAX4WA.jpg,1,Boston_bull,896,2533
2015-12-14 22:46:41,"<a href=""http://twitter.com/download/iphone"" rel=""nofollow"">Twitter for iPhone</a>",ITSOFLUFFAYYYYY 12/10 https://t.co/bfw13CnuuZ,None,12/10,https://pbs.twimg.com/media/CWOH4s9U8AEtkmQ.jpg,1,chow,621,2025
2015-12-14 20:17:59,"<a href=""http://twitter.com/download/iphone"" rel=""nofollow"">Twitter for iPhone</a>",Say hello to Griffin. He's upset because his costume for Halloween didn't arrive until today. 9/10 cheer up pup https://t.co/eoBCjSFajX,Griffin,9/10,https://pbs.twimg.com/media/CWNl3S9WcAARN34.jpg,1,pug,602,1641
2015-12-14 18:35:43,"<a href=""http://twitter.com/download/iphone"" rel=""nofollow"">Twitter for iPhone</a>",Three generations of pupper. 11/10 for all https://t.co/tAmQYvzrau,None,11/10,https://pbs.twimg.com/media/CWNOdIpWoAAWid2.jpg,1,golden_retriever,5224,12616
2015-12-14 16:34:00,"<a href=""http://twitter.com/download/iphone"" rel=""nofollow"">Twitter for iPhone</a>",Hope your Monday isn't too awful. Here's two baseball puppers. 11/10 for each https://t.co/dB0H9hdZai,None,11/10,https://pbs.twimg.com/media/CWMyl9EWUAAnZJ0.jpg,2,Maltese_dog,748,1863
2015-12-14 15:57:56,"<a href=""http://twitter.com/download/iphone"" rel=""nofollow"">Twitter for iPhone</a>","Meet Duke. He's an Urban Parmesan. They know he's scared of the green rubber dog. ""Why u do dis?"" thinks Duke. 10/10 https://t.co/3bim9U5Idr",Duke,10/10,https://pbs.twimg.com/media/CWMqV7WUYAEEClG.jpg,1,golden_retriever,385,1526
2015-12-14 03:08:46,"<a href=""http://twitter.com/download/iphone"" rel=""nofollow"">Twitter for iPhone</a>",Say hello to Winston. He has no respect for the system. Much rebellion. I think that's a palm tree... nice. 8/10 https://t.co/dOLQddhXLZ,Winston,8/10,https://pbs.twimg.com/media/CWJ6Sc-WwAAlpI6.jpg,1,French_bulldog,331,1335
2015-12-14 00:07:50,"<a href=""http://twitter.com/download/iphone"" rel=""nofollow"">Twitter for iPhone</a>",These two pups just met and have instantly bonded. Spectacular scene. Mesmerizing af. 10/10 and 7/10 for blue dog https://t.co/gwryaJO4tC,None,10/10,https://pbs.twimg.com/media/CWJQ4UmWoAIJ29t.jpg,2,Chihuahua,1145,2478
2015-12-13 21:07:04,"<a href=""http://twitter.com/download/iphone"" rel=""nofollow"">Twitter for iPhone</a>",This is Bert. He likes flowers. 10/10 https://t.co/lmQRrNxaQu,Bert,10/10,https://pbs.twimg.com/media/CWIngp5WEAAJOy3.jpg,1,Irish_water_spaniel,744,2077
2015-12-13 18:10:33,"<a href=""http://twitter.com/download/iphone"" rel=""nofollow"">Twitter for iPhone</a>",Meet Striker. He's ready for Christmas. 11/10 https://t.co/B3xxSLjQSH,Striker,11/10,https://pbs.twimg.com/media/CWH_FTgWIAAwOUy.jpg,1,Shih-Tzu,1284,3042
2015-12-13 17:21:08,"<a href=""http://twitter.com/download/iphone"" rel=""nofollow"">Twitter for iPhone</a>","""Yes hello I'ma just snag this here toasted bagel real quick. carry on."" 9/10 https://t.co/Cuz0Osnekp",None,9/10,https://pbs.twimg.com/media/CWHzzFGXIAA0Y_H.jpg,1,bull_mastiff,483,1431
2015-12-13 04:40:46,"<a href=""http://twitter.com/download/iphone"" rel=""nofollow"">Twitter for iPhone</a>",I'm sure you've all seen this pupper. Not prepared at all for the flying disc of terror. 10/10 https://t.co/G0pQiFGM7O,None,10/10,https://pbs.twimg.com/media/CWFFt3_XIAArIYK.jpg,1,Labrador_retriever,653,1774
2015-12-13 04:14:39,"<a href=""http://twitter.com/download/iphone"" rel=""nofollow"">Twitter for iPhone</a>",This is Donny. He's summoning the demon monster Babadook. 6/10 Donny please no that won't be a good time for anyone https://t.co/kiW6Knb7Gp,Donny,6/10,https://pbs.twimg.com/media/CWE_x33UwAEE3no.jpg,1,Italian_greyhound,976,2297
2015-12-13 04:02:03,"<a href=""http://twitter.com/download/iphone"" rel=""nofollow"">Twitter for iPhone</a>",Breathtaking scene. A father taking care of his newborn pup. Tugs at the heartstrings. 10/10 restores my faith https://t.co/06oZdehGEa,None,10/10,https://pbs.twimg.com/media/CWE85snWIAEG5ES.jpg,1,West_Highland_white_terrier,1067,2581
2015-12-13 02:51:51,"<a href=""http://twitter.com/download/iphone"" rel=""nofollow"">Twitter for iPhone</a>",&amp; this is Yoshi. Another world record contender 11/10 (what the hell is happening why are there so many contenders?) https://t.co/QG708dDNH6,None,11/10,https://pbs.twimg.com/media/CWEs1b-WEAEhq82.jpg,1,golden_retriever,632,1783
2015-12-13 01:41:41,"<a href=""http://twitter.com/download/iphone"" rel=""nofollow"">Twitter for iPhone</a>",Here we have an entire platoon of puppers. Total score: 88/80 would pet all at once https://t.co/y93p6FLvVw,None,88/80,https://pbs.twimg.com/media/CWEcxqWVEAAHyGH.jpg,1,Labrador_retriever,1460,2927
2015-12-13 01:12:15,"<a href=""http://twitter.com/download/iphone"" rel=""nofollow"">Twitter for iPhone</a>","This is Pepper. She's not fully comfortable riding her imaginary bike yet. 10/10 don't worry pupper, it gets easier https://t.co/40dj4eTsXG",Pepper,10/10,https://pbs.twimg.com/media/CWEWClfW4AAnqhG.jpg,1,pug,1000,2477
2015-12-12 23:41:18,"<a href=""http://twitter.com/download/iphone"" rel=""nofollow"">Twitter for iPhone</a>",ðŸŽ¶ HELLO FROM THE OTHER SIIIIIIIIDE ðŸŽ¶ 10/10s https://t.co/GK2HJtkdQk,None,10/10,https://pbs.twimg.com/media/CWEBOFYWwAA-O2c.jpg,1,Pomeranian,591,1652
2015-12-12 23:34:00,"<a href=""http://twitter.com/download/iphone"" rel=""nofollow"">Twitter for iPhone</a>",Here's a handful of sleepy puppers. All look unaware of their surroundings. Lousy guard dogs. Still cute tho 11/10s https://t.co/lyXX3v5j4s,None,11/10,https://pbs.twimg.com/media/CWD_jQMWEAAdYwH.jpg,1,basset,260,1140
2015-12-12 22:04:39,"<a href=""http://twitter.com/download/iphone"" rel=""nofollow"">Twitter for iPhone</a>",This is Bernie. He just touched a boob for the first time. 10/10 https://t.co/whQKMygnK6,Bernie,10/10,https://pbs.twimg.com/media/CWDrGH4UYAARoq_.jpg,1,beagle,3787,11101
2015-12-12 20:57:34,"<a href=""http://twitter.com/download/iphone"" rel=""nofollow"">Twitter for iPhone</a>",Say hello to Buddah. He was Waldo for Halloween. 11/10 https://t.co/DVAqAnb624,Buddah,11/10,https://pbs.twimg.com/media/CWDbv2yU4AARfeH.jpg,1,Maltese_dog,537,1750
2015-12-12 18:13:51,"<a href=""http://twitter.com/download/iphone"" rel=""nofollow"">Twitter for iPhone</a>",Here's a pupper licking in slow motion. 12/10 please enjoy https://t.co/AUJi8ujxw9,None,12/10,https://pbs.twimg.com/ext_tw_video_thumb/675740268751138818/pu/img/dVaVeFAVT-lk_1ZV.jpg,1,golden_retriever,388,1257
2015-12-12 16:16:45,"<a href=""http://twitter.com/download/iphone"" rel=""nofollow"">Twitter for iPhone</a>",This is Lenny. He was just told that he couldn't explore the fish tank. 12/10 smh all that work for nothing https://t.co/JWi6YrpiO1,Lenny,12/10,https://pbs.twimg.com/media/CWCbd8ZWoAAtqoH.jpg,2,standard_schnauzer,928,2046
2015-12-12 15:59:51,"<a href=""http://twitter.com/download/iphone"" rel=""nofollow"">Twitter for iPhone</a>",This is a Sizzlin Menorah spaniel from Brooklyn named Wylie. Lovable eyes. Chiller as hell. 10/10 and I'm out.. poof https://t.co/7E0AiJXPmI,a,10/10,https://pbs.twimg.com/media/CWCXj35VEAIFvtk.jpg,1,English_springer,106,693
2015-12-12 04:35:48,"<a href=""http://twitter.com/download/iphone"" rel=""nofollow"">Twitter for iPhone</a>",Seriously guys?! Only send in dogs. I only rate dogs. This is a baby black bear... 11/10 https://t.co/H7kpabTfLj,a,11/10,https://pbs.twimg.com/media/CV_7CV6XIAEV05u.jpg,1,chow,470,1953
2015-12-12 04:23:49,"<a href=""http://twitter.com/download/iphone"" rel=""nofollow"">Twitter for iPhone</a>",This is Ellie AKA Queen Slayer of the Orbs. Very self-motivated. Great yard. Rad foliage. 10/10 would pet diligently https://t.co/c9jmg3Xtzn,Ellie,10/10,https://pbs.twimg.com/media/CV_4ShmUYAA3wNu.jpg,1,Pembroke,428,1276
2015-12-12 03:47:46,"<a href=""http://twitter.com/download/iphone"" rel=""nofollow"">Twitter for iPhone</a>",Meet Sammy. He's a Motorola Firefox. Hat under hoodie (must be a half-decent up and coming white rapper) 10/10 https://t.co/rO2zxf0OQ0,Sammy,10/10,https://pbs.twimg.com/media/CV_wCh8W4AEWWZ9.jpg,1,cocker_spaniel,316,1122
2015-12-12 03:29:35,"<a href=""http://twitter.com/download/iphone"" rel=""nofollow"">Twitter for iPhone</a>",12/10 stay woke https://t.co/XDiQw4Akiw,None,12/10,https://pbs.twimg.com/media/CV_r3v4VAAALvwg.jpg,1,Scottish_deerhound,507,1414
2015-12-12 02:07:14,"<a href=""http://twitter.com/download/iphone"" rel=""nofollow"">Twitter for iPhone</a>",Meet Reggie. He's going for the world record. Must concentrate. Focus up pup. 11/10 we all believe in you Reggie https://t.co/h3AWz4AzuC,Reggie,11/10,https://pbs.twimg.com/media/CV_ZAhcUkAUeKtZ.jpg,1,vizsla,1443,3397
2015-12-12 01:38:53,"<a href=""http://twitter.com/download/iphone"" rel=""nofollow"">Twitter for iPhone</a>",RT until we find this dog. Clearly a cool dog (front leg relaxed out window). Looks to be a superb driver. 10/10 https://t.co/MnTrKaQ8Wn,None,10/10,https://pbs.twimg.com/media/CV_SimUWoAAvJSY.jpg,1,West_Highland_white_terrier,672,1406
2015-12-11 21:51:30,"<a href=""http://twitter.com/download/iphone"" rel=""nofollow"">Twitter for iPhone</a>",Happy Friday. Here's some golden puppers. 12/10 for all https://t.co/wNkqAED6lG,None,12/10,https://pbs.twimg.com/media/CV-ef64WoAAbh0I.jpg,1,Labrador_retriever,627,1623
2015-12-11 17:51:04,"<a href=""http://twitter.com/download/iphone"" rel=""nofollow"">Twitter for iPhone</a>","The tail alone is 13/10. Great dog, better owner https://t.co/IyAXinfyju",None,13/10,https://pbs.twimg.com/media/CV9nd30XAAAEba5.jpg,1,Chihuahua,563,1838
2015-12-11 17:12:48,"<a href=""http://twitter.com/download/iphone"" rel=""nofollow"">Twitter for iPhone</a>",This is Daisy. She loves that shoe. Still no seat belt. Super churlish. 12/10 the dogs are killing it today https://t.co/cZlkvgRPdn,Daisy,12/10,https://pbs.twimg.com/media/CV9etctWUAAl5Hp.jpg,1,Labrador_retriever,262,1136
2015-12-11 16:20:15,"<a href=""http://twitter.com/download/iphone"" rel=""nofollow"">Twitter for iPhone</a>",Yea I lied. Here's more. All 13/10 https://t.co/ZQZf2U4xCP,None,13/10,https://pbs.twimg.com/media/CV9SrABU4AQI46z.jpg,3,borzoi,2532,4237
2015-12-11 15:19:21,"<a href=""http://twitter.com/download/iphone"" rel=""nofollow"">Twitter for iPhone</a>",Good morning here's a grass pupper. 12/10 https://t.co/2d68FmWGGs,None,12/10,https://pbs.twimg.com/media/CV9EvZNUwAAgLCK.jpg,2,Pembroke,1436,3007
2015-12-11 03:05:37,"<a href=""http://twitter.com/download/iphone"" rel=""nofollow"">Twitter for iPhone</a>",holy shit 12/10 https://t.co/p6O8X93bTQ,None,12/10,https://pbs.twimg.com/media/CV6czeEWEAEdChp.jpg,1,chow,1878,4037
2015-12-11 02:56:28,"<a href=""http://twitter.com/download/iphone"" rel=""nofollow"">Twitter for iPhone</a>",When you're presenting a group project and the 4th guy tells the teacher that he did all the work. 10/10 https://t.co/f50mbB4UWS,None,10/10,https://pbs.twimg.com/media/CV6atgoWcAEsdv6.jpg,1,golden_retriever,273,1026
2015-12-11 02:49:59,"<a href=""http://twitter.com/download/iphone"" rel=""nofollow"">Twitter for iPhone</a>",What an honor. 3 dogs here. Blond one is clearly a gymnast. Other two just confused. Very nifty pups. 9/10 for all https://t.co/YDgstgIDGs,None,9/10,https://pbs.twimg.com/media/CV6ZOPqWsAA20Uj.jpg,1,Labrador_retriever,1011,2305
2015-12-11 00:35:44,"<a href=""http://twitter.com/download/iphone"" rel=""nofollow"">Twitter for iPhone</a>",Say hello to Oliver. He thought what was inside the pillow should be outside the pillow. Blurry since birth. 8/10 https://t.co/lFU9W31Fg9,Oliver,8/10,https://pbs.twimg.com/media/CV56f54WsAEv4kJ.jpg,1,Labrador_retriever,283,1042
2015-12-11 00:26:12,"<a href=""http://twitter.com/download/iphone"" rel=""nofollow"">Twitter for iPhone</a>",C'mon guys. We've been over this. We only rate dogs. This is a cow. Please only submit dogs. Thank you...... 9/10 https://t.co/WjcELNEqN2,a,9/10,https://pbs.twimg.com/media/CV54UQTXAAAGf-j.jpg,1,dalmatian,1259,3006
2015-12-10 20:19:52,"<a href=""http://twitter.com/download/iphone"" rel=""nofollow"">Twitter for iPhone</a>",This is a fluffy albino Bacardi Columbia mix. Excellent at the tweets. 11/10 would hug gently https://t.co/diboDRUuEI,a,11/10,https://pbs.twimg.com/media/CV4_8FgXAAQOj4S.jpg,1,Samoyed,366,1141
2015-12-10 17:37:00,"<a href=""http://twitter.com/download/iphone"" rel=""nofollow"">Twitter for iPhone</a>",Say hello to Mollie. This pic was taken after she bet all her toys on Ronda Rousey. 10/10 hang in there pupper https://t.co/QMmAqA9VqO,Mollie,10/10,https://pbs.twimg.com/media/CV4aqCwWsAIi3OP.jpg,1,boxer,252,1057
2015-12-10 17:24:21,"<a href=""http://twitter.com/download/iphone"" rel=""nofollow"">Twitter for iPhone</a>",Meet Laela. She's adorable. Magnificent eyes. But I don't see a seat belt. Insubordinate.. and churlish. Still 12/10 https://t.co/pCGDgLkLo6,Laela,12/10,https://pbs.twimg.com/media/CV4XwYiWoAAHQIF.jpg,1,Pembroke,517,1672
2015-12-10 17:11:09,"<a href=""http://twitter.com/download/iphone"" rel=""nofollow"">Twitter for iPhone</a>",Ok last one of these. I may try to make some myself. Anyway here ya go. 13/10 https://t.co/i9CDd1oEu8,None,13/10,https://pbs.twimg.com/media/CV4UvgNUkAEEnZd.jpg,1,Rottweiler,1232,2433
2015-12-10 04:18:42,"<a href=""http://twitter.com/download/iphone"" rel=""nofollow"">Twitter for iPhone</a>","When your entire life is crumbling before you and you're trying really hard to hold your shit together.
10/10 https://t.co/vqFkgYPCW8",None,10/10,https://pbs.twimg.com/ext_tw_video_thumb/674805331965399040/pu/img/-7bw8niVrgIkLKOW.jpg,1,English_springer,391,934
2015-12-10 03:59:15,"<a href=""http://twitter.com/download/iphone"" rel=""nofollow"">Twitter for iPhone</a>",This is Tedders. He broke his leg saving babies from the Pompeii eruption. 11/10 where's his Purple Heart? @POTUS https://t.co/cMI2AcLm4B,Tedders,11/10,https://pbs.twimg.com/media/CV1ffl3XAAAiFyr.jpg,1,Pembroke,949,3240
2015-12-10 03:30:58,"<a href=""http://twitter.com/download/iphone"" rel=""nofollow"">Twitter for iPhone</a>",I have found another. 13/10 https://t.co/HwroPYv8pY,None,13/10,https://pbs.twimg.com/media/CV1ZA3oWEAA1HW_.jpg,1,giant_schnauzer,1225,2697
2015-12-10 03:19:24,"<a href=""http://twitter.com/download/iphone"" rel=""nofollow"">Twitter for iPhone</a>",ER... MER... GERD 13/10 https://t.co/L1puJISV1a,None,13/10,https://pbs.twimg.com/media/CV1WXsmWcAAgQ56.jpg,1,Labrador_retriever,278,1180
2015-12-10 03:11:43,"<a href=""http://twitter.com/download/iphone"" rel=""nofollow"">Twitter for iPhone</a>",Say hello to Maggie. She's a Western Septic Downy. Pretends to be Mexican. Great hardwood flooring. 9/10 https://t.co/P3ElQ2wsjb,Maggie,9/10,https://pbs.twimg.com/media/CV1Um8vWIAAmhQn.jpg,1,miniature_poodle,230,871
2015-12-10 02:15:47,"<a href=""http://twitter.com/download/iphone"" rel=""nofollow"">Twitter for iPhone</a>",This is Superpup. His head isn't proportional to his body. Has yet to serve any justice. 11/10 maybe one day pupper https://t.co/gxIFgg8ktm,Superpup,11/10,https://pbs.twimg.com/media/CV1HztsWoAAuZwo.jpg,1,Chihuahua,532,1213
2015-12-10 01:37:23,"<a href=""http://twitter.com/download/iphone"" rel=""nofollow"">Twitter for iPhone</a>",These two pups are masters of camouflage. Very dedicated to the craft. Both must've spent decades practicing. 10/10s https://t.co/RBiQ8hPqwr,None,10/10,https://pbs.twimg.com/media/CV0_BSuWIAIvE9k.jpg,2,Samoyed,263,852
2015-12-10 00:47:23,"<a href=""http://twitter.com/download/iphone"" rel=""nofollow"">Twitter for iPhone</a>",Everyone please just appreciate how perfect these two photos are. 12/10 for both https://t.co/rLf7asnHxO,None,12/10,https://pbs.twimg.com/media/CV0zkzEU4AAzLc5.jpg,2,vizsla,516,1580
2015-12-10 00:10:43,"<a href=""http://twitter.com/download/iphone"" rel=""nofollow"">Twitter for iPhone</a>",This is Sophie. She just saw a spider. 10/10 don't just stand there Sophie https://t.co/VagYftZccT,Sophie,10/10,https://pbs.twimg.com/media/CV0rL7RWEAAbhqm.jpg,1,Bernese_mountain_dog,607,1514
2015-12-09 23:58:35,"<a href=""http://twitter.com/download/iphone"" rel=""nofollow"">Twitter for iPhone</a>","""ðŸŽ¶ DO YOU BELIEVE IN LIFE AFTER LOVE ðŸŽ¶""
11/10 https://t.co/URNs5zFskc",None,11/10,https://pbs.twimg.com/media/CV0oaHFW4AA9Coi.jpg,1,Dandie_Dinmont,437,1194
2015-12-09 23:47:22,"<a href=""http://twitter.com/download/iphone"" rel=""nofollow"">Twitter for iPhone</a>",Meet Rufio. He is unaware of the pink legless pupper wrapped around him. Might want to get that checked 10/10 &amp; 4/10 https://t.co/KNfLnYPmYh,Rufio,10/10,https://pbs.twimg.com/media/CV0l10AU8AAfg-a.jpg,1,Pomeranian,103,693
2015-12-09 19:22:56,"<a href=""http://twitter.com/download/iphone"" rel=""nofollow"">Twitter for iPhone</a>",Meet Jeb &amp; Bush. Jeb is somehow stuck in that fence and Bush won't stop whispering sweet nothings in his ear. 9/10s https://t.co/NRNExUy9Hm,Jeb,9/10,https://pbs.twimg.com/media/CVzpUGUWUAAo7Vn.jpg,1,malamute,729,1751
2015-12-09 17:46:48,"<a href=""http://twitter.com/download/iphone"" rel=""nofollow"">Twitter for iPhone</a>",Two gorgeous dogs here. Little waddling dog is a rebel. Refuses to look at camera. Must be a preteen. 5/10 &amp; 8/10 https://t.co/YPfw7oahbD,None,5/10,https://pbs.twimg.com/media/CVzTUGrW4AAirJH.jpg,1,flat-coated_retriever,557,1533
2015-12-09 17:15:54,"<a href=""http://twitter.com/download/iphone"" rel=""nofollow"">Twitter for iPhone</a>",This pupper is fed up with being tickled. 12/10 I'm currently working on an elaborate heist to steal this dog https://t.co/F33n1hy3LL,None,12/10,https://pbs.twimg.com/media/CVzMPh1UsAELQ_p.jpg,1,Pomeranian,650,1806
2015-12-09 06:01:26,"<a href=""http://twitter.com/download/iphone"" rel=""nofollow"">Twitter for iPhone</a>",This is Louis. He thinks he's flying. 13/10 this is a legendary pup https://t.co/6d9WziPXmx,Louis,13/10,https://pbs.twimg.com/media/CVwx3dQXAAA0ksL.jpg,2,chow,2275,6676
2015-12-09 04:36:06,"<a href=""http://twitter.com/download/iphone"" rel=""nofollow"">Twitter for iPhone</a>",This pupper just wants a belly rub. This pupper has nothing to do w the tree being sideways now. 10/10 good pupper https://t.co/AyJ7Ohk71f,None,10/10,https://pbs.twimg.com/media/CVweVUfW4AACPwI.jpg,1,Brabancon_griffon,393,1137
2015-12-09 02:56:22,"<a href=""http://twitter.com/download/iphone"" rel=""nofollow"">Twitter for iPhone</a>",This is Ava. She doesn't understand flowers. 12/10 would caress firmly https://t.co/BxTJAFSIgk,Ava,12/10,https://pbs.twimg.com/media/CVwHgblWcAACWOD.jpg,1,golden_retriever,592,1536
2015-12-09 02:34:18,"<a href=""http://twitter.com/download/iphone"" rel=""nofollow"">Twitter for iPhone</a>",This is Jonah. He's a Stinted Fisher Price. Enjoys chewing on his miniature RipStik. 10/10 very upbeat fellow https://t.co/7qjXy1uUYY,Jonah,10/10,https://pbs.twimg.com/media/CVwCdCFW4AUHY4D.jpg,1,Chihuahua,157,731
2015-12-08 18:17:56,"<a href=""http://twitter.com/download/iphone"" rel=""nofollow"">Twitter for iPhone</a>",This is Kenny. He just wants to be included in the happenings. 11/10 https://t.co/2S6oye3XqK,Kenny,11/10,https://pbs.twimg.com/media/CVuQ2LeUsAAIe3s.jpg,1,Cardigan,6533,15817
2015-12-08 16:56:51,"<a href=""http://twitter.com/download/iphone"" rel=""nofollow"">Twitter for iPhone</a>","""AT DAWN, WE RIDE""
10/10 for both dogs https://t.co/3aXX6wH6it",None,10/10,https://pbs.twimg.com/media/CVt-SeMWwAAs9HH.jpg,1,German_shepherd,800,1682
2015-12-08 16:47:50,"<a href=""http://twitter.com/download/iphone"" rel=""nofollow"">Twitter for iPhone</a>","This is Bob. He's a Juniper Fitzsimmons. His body is 2, but his face is 85. Always looks miserable. Nice stool. 8/10 https://t.co/vYe9RlVz2N",Bob,8/10,https://pbs.twimg.com/media/CVt8OmIWIAAbxvJ.jpg,1,pug,255,961
2015-12-08 16:21:41,"<a href=""http://twitter.com/download/iphone"" rel=""nofollow"">Twitter for iPhone</a>",This is Gus. He's super stoked about being an elephant. Couldn't be happier. 9/10 for elephant pupper https://t.co/gJS1qU0jP7,Gus,9/10,https://pbs.twimg.com/media/CVt2PawWIAEUkqW.jpg,1,Greater_Swiss_Mountain_dog,498,1391
2015-12-08 15:52:13,"<a href=""http://twitter.com/download/iphone"" rel=""nofollow"">Twitter for iPhone</a>",Say hello to Bobbay. He's a marshmallow wizard. 10/10 https://t.co/r6LZN1o1Gx,Bobbay,10/10,https://pbs.twimg.com/media/CVtvf6bWwAAd1rT.jpg,1,Eskimo_dog,619,1581
2015-12-08 04:27:30,"<a href=""http://twitter.com/download/iphone"" rel=""nofollow"">Twitter for iPhone</a>",This is a Sagitariot Baklava mix. Loves her new hat. 11/10 radiant pup https://t.co/Bko5kFJYUU,a,11/10,https://pbs.twimg.com/media/CVrSxy7WsAAFD2F.jpg,1,Pomeranian,186,804
2015-12-08 03:57:26,"<a href=""http://twitter.com/download/iphone"" rel=""nofollow"">Twitter for iPhone</a>",Say hello to Mitch. He thinks that's a hat. Nobody has told him yet. 11/10 please no one tell him https://t.co/7jOPktauh4,Mitch,11/10,https://pbs.twimg.com/media/CVrL5YBWoAA_uPD.jpg,1,Airedale,316,1047
2015-12-08 02:29:37,"<a href=""http://twitter.com/download/iphone"" rel=""nofollow"">Twitter for iPhone</a>","This is Stanley. Yes he is aware of the spoon's presence, he just doesn't know what he should do about it. 10/10 https://t.co/gQAMg5ypW5",Stanley,10/10,https://pbs.twimg.com/media/CVq3zAaWwAA8vpk.jpg,1,Cardigan,1441,3576
2015-12-08 02:23:09,"<a href=""http://twitter.com/download/iphone"" rel=""nofollow"">Twitter for iPhone</a>",This is Lucy. She knits. Specializes in toboggans. 10/10 I'd buy a toboggan from Lucy https://t.co/YE2XDHy4Yk,Lucy,10/10,https://pbs.twimg.com/media/CVq2UHwWEAAduMw.jpg,1,Shih-Tzu,530,1564
2015-12-08 01:47:22,"<a href=""http://twitter.com/download/iphone"" rel=""nofollow"">Twitter for iPhone</a>",Yea I can't handle the cuteness anymore. Curls for days. 12/10 for all https://t.co/sAI6gCGZYX,None,12/10,https://pbs.twimg.com/media/CVquIDRW4AEJrPk.jpg,1,toy_poodle,142,772
